Created,CreatedUniversal,CreatedSimple,MediaUrl,TweetId,MediaId,MediaIndex,UserId,Username,TweetUrl,TweetText,Filename
12/31/2020 23:21:13,2020-12-31 23:21:13Z,2020-12-31 11:21:13,https://pbs.twimg.com/media/EqmjeYKXIAELFXD.jpg,1344785711489306626,1344785706024116225,0,4871511149,MetTaskforce,https://twitter.com/MetTaskforce/status/1344785711489306626,"Someone will be seeing in the New Year in custody after #TSG U544 attended a call on @MPSWandsworth where a male was making threats with a knife. He was arrested for affray and possession of offensive weapons, after being found with the below knives ^5680U https://t.co/68pwEUwDXg",2020-12-31 11:21:13 MetTaskforce 1344785711489306626 0.jpg
12/31/2020 23:21:13,2020-12-31 23:21:13Z,2020-12-31 11:21:13,https://pbs.twimg.com/media/EqmjeX_XAAA3aGt.jpg,1344785711489306626,1344785705977970688,1,4871511149,MetTaskforce,https://twitter.com/MetTaskforce/status/1344785711489306626,"Someone will be seeing in the New Year in custody after #TSG U544 attended a call on @MPSWandsworth where a male was making threats with a knife. He was arrested for affray and possession of offensive weapons, after being found with the below knives ^5680U https://t.co/68pwEUwDXg",2020-12-31 11:21:13 MetTaskforce 1344785711489306626 1.jpg
12/31/2020 18:38:38,2020-12-31 18:38:38Z,2020-12-31 06:38:38,https://pbs.twimg.com/media/EqlizPZXEAYosBE.jpg,1344714599409606663,1344714596192555014,0,4871511149,MetTaskforce,https://twitter.com/MetTaskforce/status/1344714599409606663,"#U22 final patrol of #2020Ends @ealingMPS when this blade was found close to hand, when the driver of a van was stopped in suspicions circumstances. His #NYE tier 4 compliant celebrations are temporarily on hold. https://t.co/yJrTulsUk8",2020-12-31 06:38:38 MetTaskforce 1344714599409606663 0.jpg
12/31/2020 15:42:57,2020-12-31 15:42:57Z,2020-12-31 03:42:57,https://pbs.twimg.com/media/Eqk6lj2XUAAAAUK.jpg,1344670384440930304,1344670380699635712,0,4871511149,MetTaskforce,https://twitter.com/MetTaskforce/status/1344670384440930304,"Last night, #TSG U543 were on patrol in @MPSSouthfields when a male on a e-scooter tried to make off. He was quickly detained &amp; searched. A quantity of drugs &amp; the below knife was found. He was arrested for PWITS Class B &amp; possession of an offensive weapon #stopandseaech ^5680U https://t.co/OPPtu2IDuz",2020-12-31 03:42:57 MetTaskforce 1344670384440930304 0.jpg
12/31/2020 05:44:18,2020-12-31 05:44:18Z,2020-12-31 05:44:18,https://pbs.twimg.com/media/EqixkJsXIAAtL1A.jpg,1344519732519702529,1344519723405484032,0,4871511149,MetTaskforce,https://twitter.com/MetTaskforce/status/1344519732519702529,"Officers from U44 were on patrol in Notting Hill @MPSKenChel #AWBCU as part of Commissioners Reserve. After a stop of a vehicle, this nasty weapon and Class A drugs were recovered and one person in custody.  #stopandsearchworks #TSG 4454U https://t.co/8sF7g8cxDx",2020-12-31 05:44:18 MetTaskforce 1344519732519702529 0.jpg
12/30/2020 17:23:08,2020-12-30 17:23:08Z,2020-12-30 05:23:08,https://pbs.twimg.com/media/EqgH7PLXAAAxzvK.jpg,1344333211527225349,1344333203037945856,0,4871511149,MetTaskforce,https://twitter.com/MetTaskforce/status/1344333211527225349,This fearsome weapon was discarded by a man during a horseback pursuit in #Bow after what started as a simple cannabis stop. PH Judge once again striking a blow in the war on crime. Stay safe out there friends &amp; colleagues. ^309CO https://t.co/shhW8zihED,2020-12-30 05:23:08 MetTaskforce 1344333211527225349 0.jpg
12/30/2020 17:23:08,2020-12-30 17:23:08Z,2020-12-30 05:23:08,https://pbs.twimg.com/media/EqgH7ikXcAMSbDU.jpg,1344333211527225349,1344333208243105795,1,4871511149,MetTaskforce,https://twitter.com/MetTaskforce/status/1344333211527225349,This fearsome weapon was discarded by a man during a horseback pursuit in #Bow after what started as a simple cannabis stop. PH Judge once again striking a blow in the war on crime. Stay safe out there friends &amp; colleagues. ^309CO https://t.co/shhW8zihED,2020-12-30 05:23:08 MetTaskforce 1344333211527225349 1.jpg
12/23/2020 18:34:11,2020-12-23 18:34:11Z,2020-12-23 06:34:11,https://pbs.twimg.com/media/Ep8VD3LXIAE3G69.jpg,1341814377276698625,1341814370075090945,0,4871511149,MetTaskforce,https://twitter.com/MetTaskforce/status/1341814377276698625,"#TSG U54 stopped a vehicle on Clapham Common @MPSWandsworth. Both the occupant and the vehicle were searched, where the below items were found. He was arrested for possession of an offensive weapon and PWITS Class A #stopandsearch ^5680U https://t.co/46Z0OfTmvv",2020-12-23 06:34:11 MetTaskforce 1341814377276698625 0.jpg
12/23/2020 18:34:11,2020-12-23 18:34:11Z,2020-12-23 06:34:11,https://pbs.twimg.com/media/Ep8VD3GXUAElbOi.jpg,1341814377276698625,1341814370054131713,1,4871511149,MetTaskforce,https://twitter.com/MetTaskforce/status/1341814377276698625,"#TSG U54 stopped a vehicle on Clapham Common @MPSWandsworth. Both the occupant and the vehicle were searched, where the below items were found. He was arrested for possession of an offensive weapon and PWITS Class A #stopandsearch ^5680U https://t.co/46Z0OfTmvv",2020-12-23 06:34:11 MetTaskforce 1341814377276698625 1.jpg
12/23/2020 16:34:26,2020-12-23 16:34:26Z,2020-12-23 04:34:26,https://pbs.twimg.com/media/Ep75plpW4AcGGh6.jpg,1341784239486988293,1341784231878516743,0,4871511149,MetTaskforce,https://twitter.com/MetTaskforce/status/1341784239486988293,"Vehicle stop on #WhistonRoad, E2 in @MPSHackney by TSG U53. 2 males stop and searched - found to have 2 knives (1 lock knife), £10,000 cash, a lot of Class A, B and C drugs and scales. Both arrested for Points and Blades and Supplying Class A/B/C drugs. #BadSanta ^ 5268U https://t.co/XKWs3m9TNh",2020-12-23 04:34:26 MetTaskforce 1341784239486988293 0.jpg
12/23/2020 16:34:26,2020-12-23 16:34:26Z,2020-12-23 04:34:26,https://pbs.twimg.com/media/Ep75plnWMAYyWHv.jpg,1341784239486988293,1341784231870083078,1,4871511149,MetTaskforce,https://twitter.com/MetTaskforce/status/1341784239486988293,"Vehicle stop on #WhistonRoad, E2 in @MPSHackney by TSG U53. 2 males stop and searched - found to have 2 knives (1 lock knife), £10,000 cash, a lot of Class A, B and C drugs and scales. Both arrested for Points and Blades and Supplying Class A/B/C drugs. #BadSanta ^ 5268U https://t.co/XKWs3m9TNh",2020-12-23 04:34:26 MetTaskforce 1341784239486988293 1.jpg
12/23/2020 16:34:26,2020-12-23 16:34:26Z,2020-12-23 04:34:26,https://pbs.twimg.com/media/Ep75plqXMAEW1aM.jpg,1341784239486988293,1341784231882731521,2,4871511149,MetTaskforce,https://twitter.com/MetTaskforce/status/1341784239486988293,"Vehicle stop on #WhistonRoad, E2 in @MPSHackney by TSG U53. 2 males stop and searched - found to have 2 knives (1 lock knife), £10,000 cash, a lot of Class A, B and C drugs and scales. Both arrested for Points and Blades and Supplying Class A/B/C drugs. #BadSanta ^ 5268U https://t.co/XKWs3m9TNh",2020-12-23 04:34:26 MetTaskforce 1341784239486988293 2.jpg
12/23/2020 16:34:26,2020-12-23 16:34:26Z,2020-12-23 04:34:26,https://pbs.twimg.com/media/Ep75plrXMAE29LS.jpg,1341784239486988293,1341784231886925825,3,4871511149,MetTaskforce,https://twitter.com/MetTaskforce/status/1341784239486988293,"Vehicle stop on #WhistonRoad, E2 in @MPSHackney by TSG U53. 2 males stop and searched - found to have 2 knives (1 lock knife), £10,000 cash, a lot of Class A, B and C drugs and scales. Both arrested for Points and Blades and Supplying Class A/B/C drugs. #BadSanta ^ 5268U https://t.co/XKWs3m9TNh",2020-12-23 04:34:26 MetTaskforce 1341784239486988293 3.jpg
12/22/2020 02:41:27,2020-12-22 02:41:27Z,2020-12-22 02:41:27,https://pbs.twimg.com/media/EpzxZ9iXUAAfDkO.jpg,1341212224426287104,1341212217367285760,0,4871511149,MetTaskforce,https://twitter.com/MetTaskforce/status/1341212224426287104,"U515 start the Commissioner’s Reserve week patrolling @MPSHackney with 2 arrests for drug supply, money laundering, drug-drive &amp; possession of this weapon. #knifecrime #stopandsearch https://t.co/c1XwXGbrSQ",2020-12-22 02:41:27 MetTaskforce 1341212224426287104 0.jpg
12/20/2020 17:43:07,2020-12-20 17:43:07Z,2020-12-20 05:43:07,https://pbs.twimg.com/media/EpssmkmWwAE72KT.jpg,1340714359442579458,1340714355244056577,0,4871511149,MetTaskforce,https://twitter.com/MetTaskforce/status/1340714359442579458,"Op Gilts, joint working between NE BCU, CE BCU, 3 TSG &amp; TFL. Over £100k of stolen property recovered and 34 arrests including an offender wanted for a series of knife point robberies @MPSTowerHam @MPSHackney @TfL @MPSNewham https://t.co/6oDMoYFrz5",2020-12-20 05:43:07 MetTaskforce 1340714359442579458 0.jpg
12/20/2020 07:43:29,2020-12-20 07:43:29Z,2020-12-20 07:43:29,https://pbs.twimg.com/media/EpqjXA9XYAApk8t.jpg,1340563456920006657,1340563454885847040,0,4871511149,MetTaskforce,https://twitter.com/MetTaskforce/status/1340563456920006657,"TSG U22 conducting violent crime patrols in the Acton area of @ealingMPS yesterday came across a group of young men being approached by drunk male seen with this knife! Prevention is key, lives saved no doubt... Male arrested! #RightPlaceRightTime #knifefree #TSG https://t.co/3quxf6Qu1O",2020-12-20 07:43:29 MetTaskforce 1340563456920006657 0.jpg
12/18/2020 07:54:58,2020-12-18 07:54:58Z,2020-12-18 07:54:58,https://pbs.twimg.com/media/EpgSzyTWMAAiikC.jpg,1339841572100317185,1339841570028269568,0,4871511149,MetTaskforce,https://twitter.com/MetTaskforce/status/1339841572100317185,TSG U22 working with our Dog Support Unit this morning in @MPSHillingdon. This large knife would have been missed if it wasn't for Police Dog Kima sniffing it out! 2 knifes found and vital evidence of a recent stabbing seized! #DogsofTwittter #TSG #DSU https://t.co/NNx93Kb8rn,2020-12-18 07:54:58 MetTaskforce 1339841572100317185 0.jpg
12/17/2020 22:29:30,2020-12-17 22:29:30Z,2020-12-17 10:29:30,https://pbs.twimg.com/media/EpeRYSsXUAUk8Ps.jpg,1339699268559511554,1339699260686815237,0,4871511149,MetTaskforce,https://twitter.com/MetTaskforce/status/1339699268559511554,"#U23 on plain clothes patrol at St Pancras. Male runs from @BTPLondon colleagues and #taskforce dogs, discarding this knife. He didn't get very far. #TSG #stopandsearchsaveslives 2646U https://t.co/ARktFCgwEc",2020-12-17 10:29:30 MetTaskforce 1339699268559511554 0.jpg
12/17/2020 22:16:52,2020-12-17 22:16:52Z,2020-12-17 10:16:52,https://pbs.twimg.com/media/EpeOeXdW4AENFTS.jpg,1339696090464083969,1339696066510381057,0,4871511149,MetTaskforce,https://twitter.com/MetTaskforce/status/1339696090464083969,"U43 have been working with @BTPLondon &amp; #Taskforce PD Jensen &amp; his handler over the last few days at #LondonBridgeStation as part of #OpNetwork. We have seized drugs, weapons and arrested subjects wanted for a multitude of offences. #OffTheRails #DontChooChooChooseCrime ^4823U https://t.co/TN6pNtWgFP",2020-12-17 10:16:52 MetTaskforce 1339696090464083969 0.jpg
12/17/2020 22:16:52,2020-12-17 22:16:52Z,2020-12-17 10:16:52,https://pbs.twimg.com/media/EpeOeouXUAA6TyT.jpg,1339696090464083969,1339696071145115648,1,4871511149,MetTaskforce,https://twitter.com/MetTaskforce/status/1339696090464083969,"U43 have been working with @BTPLondon &amp; #Taskforce PD Jensen &amp; his handler over the last few days at #LondonBridgeStation as part of #OpNetwork. We have seized drugs, weapons and arrested subjects wanted for a multitude of offences. #OffTheRails #DontChooChooChooseCrime ^4823U https://t.co/TN6pNtWgFP",2020-12-17 10:16:52 MetTaskforce 1339696090464083969 1.jpg
12/17/2020 07:59:09,2020-12-17 07:59:09Z,2020-12-17 07:59:09,https://pbs.twimg.com/media/EpbKKQeXcAEmxhq.jpg,1339480236602343426,1339480216759136257,0,4871511149,MetTaskforce,https://twitter.com/MetTaskforce/status/1339480236602343426,"U41 executed a drugs warrants in the early hours of this morning in Croydon. Inside the address was a quantity of class A and B, scales, numerous phones and large knife. Just some of the items found inside the premises #knivesoffthestreet #CountyLines #earlymorningwakeup https://t.co/BpB5P3ACcC",2020-12-17 07:59:09 MetTaskforce 1339480236602343426 0.jpg
12/16/2020 08:56:37,2020-12-16 08:56:37Z,2020-12-16 08:56:37,https://pbs.twimg.com/media/EpWLZKjWEAANqQ6.jpg,1339132312794124290,1339129728658182144,0,4871511149,MetTaskforce,https://twitter.com/MetTaskforce/status/1339132312794124290,"#TSG U23 on plain clothes patrol around @KingsCross and @StPancras Tuesday evening. Looking for county lines drug dealing. A male trying to evade our attention but was stopped, searched &amp; arrested for possession of a lock knife in his trousers. 2398U
#stopandsearchworks
#StaySafe https://t.co/02EKkEUTbp",2020-12-16 08:56:37 MetTaskforce 1339132312794124290 0.jpg
12/15/2020 20:06:47,2020-12-15 20:06:47Z,2020-12-15 08:06:47,https://pbs.twimg.com/media/EpTdiJ9WMAAVaXX.jpg,1338938575170232325,1338938568094396416,0,4871511149,MetTaskforce,https://twitter.com/MetTaskforce/status/1338938575170232325,"#TSG U545 were on patrol around @MPSWandsworth when a male decamped from a vehicle. Officers gave chase to the male, who was in possession of the below knife. He was detained, searched and arrested for PWITS class B &amp; possession of an offensive weapon #stopandsearch ^5680U https://t.co/1UcDMAEhCn",2020-12-15 08:06:47 MetTaskforce 1338938575170232325 0.jpg
12/15/2020 04:16:36,2020-12-15 04:16:36Z,2020-12-15 04:16:36,https://pbs.twimg.com/media/EpQEDm2W8AAY87T.jpg,1338699453537062912,1338699449250541568,0,4871511149,MetTaskforce,https://twitter.com/MetTaskforce/status/1338699453537062912,TSG U22 patrolling in @ealingMPS tonight stopped a vehicle in a well known gang hotspot. The driver failed a roadside drug test and its passenger was found to have this weapon as well as a large quantity of drugs on his person! 2 Arrested #knifefree #Stopandsearchworks https://t.co/kR0EViWR2Q,2020-12-15 04:16:36 MetTaskforce 1338699453537062912 0.jpg
12/11/2020 23:15:50,2020-12-11 23:15:50Z,2020-12-11 11:15:50,https://pbs.twimg.com/media/Eo_ibjeWEAATohk.jpg,1337536601317105666,1337536577359187968,0,4871511149,MetTaskforce,https://twitter.com/MetTaskforce/status/1337536601317105666,U43 came across #ClaphamHighStreets version of Father Christmas last night with lots of little stocking fillers on @LambethMPS &amp; already tonight we have found this naughty knife in the trousers of a young man on #TowerBridgeRoad @MPSSouthwark. #StopAndSearch #LumpOfCoal ^4823U https://t.co/vcopSq9ljH,2020-12-11 11:15:50 MetTaskforce 1337536601317105666 0.jpg
12/11/2020 23:15:50,2020-12-11 23:15:50Z,2020-12-11 11:15:50,https://pbs.twimg.com/media/Eo_icNYXcAAoAw1.jpg,1337536601317105666,1337536588608401408,1,4871511149,MetTaskforce,https://twitter.com/MetTaskforce/status/1337536601317105666,U43 came across #ClaphamHighStreets version of Father Christmas last night with lots of little stocking fillers on @LambethMPS &amp; already tonight we have found this naughty knife in the trousers of a young man on #TowerBridgeRoad @MPSSouthwark. #StopAndSearch #LumpOfCoal ^4823U https://t.co/vcopSq9ljH,2020-12-11 11:15:50 MetTaskforce 1337536601317105666 1.jpg
12/09/2020 14:23:39,2020-12-09 14:23:39Z,2020-12-09 02:23:39,https://pbs.twimg.com/media/EozVdY2WMAAL6wh.jpg,1336677896459575297,1336677890285514752,0,4871511149,MetTaskforce,https://twitter.com/MetTaskforce/status/1336677896459575297,"#TSG U236 plain clothes unit on patrol last night in @MPSHounslow stopped 2 males acting a little suspiciously. A search of their car revealed this large machete. Both arrested for Possesion of an Offensive Weapon. 2398U
#stopandsearchworks 
#StopKnifeCrime https://t.co/dCv9zHTh4j",2020-12-09 02:23:39 MetTaskforce 1336677896459575297 0.jpg
12/08/2020 21:48:05,2020-12-08 21:48:05Z,2020-12-08 09:48:05,https://pbs.twimg.com/media/EovxkdnW4AMzAwM.jpg,1336427353153691662,1336427323172773891,0,4871511149,MetTaskforce,https://twitter.com/MetTaskforce/status/1336427353153691662,"Night 1 of 7 for U4:3 yesterday across @MPSSouthwark &amp; @LambethMPS. We came across some naughty elves stealing cars, carrying knives &amp; using drugs. All through proactive use of stop &amp; search. #NaughtyList #MondayMotivation. ^4823U https://t.co/B4uEJhXxOJ",2020-12-08 09:48:05 MetTaskforce 1336427353153691662 0.jpg
12/08/2020 21:48:05,2020-12-08 21:48:05Z,2020-12-08 09:48:05,https://pbs.twimg.com/media/EovxlXDWEAMMtkv.jpg,1336427353153691662,1336427338590982147,1,4871511149,MetTaskforce,https://twitter.com/MetTaskforce/status/1336427353153691662,"Night 1 of 7 for U4:3 yesterday across @MPSSouthwark &amp; @LambethMPS. We came across some naughty elves stealing cars, carrying knives &amp; using drugs. All through proactive use of stop &amp; search. #NaughtyList #MondayMotivation. ^4823U https://t.co/B4uEJhXxOJ",2020-12-08 09:48:05 MetTaskforce 1336427353153691662 1.jpg
12/06/2020 07:30:59,2020-12-06 07:30:59Z,2020-12-06 07:30:59,https://pbs.twimg.com/media/EoiaPe_XIAAQ46x.jpg,1335486883879641088,1335486880322887680,0,4871511149,MetTaskforce,https://twitter.com/MetTaskforce/status/1335486883879641088,#TSG U54 were conducting patrols around @MPSSouthwark when they noticed a group acting suspiciously in a robbery hotspot area. The group were searched and one was arrested for possession of an offensive weapon after the below knife was found on them ^5680U #stopandsearch https://t.co/uEv4EpVYNI,2020-12-06 07:30:59 MetTaskforce 1335486883879641088 0.jpg
12/06/2020 07:25:59,2020-12-06 07:25:59Z,2020-12-06 07:25:59,https://pbs.twimg.com/media/EoiZGGDWEAAMi-S.jpg,1335485624355344384,1335485619498258432,0,4871511149,MetTaskforce,https://twitter.com/MetTaskforce/status/1335485624355344384,#TSG A busy night shift comes to an end for U54. First stop of the night on @MPSWandsworth saw 4 arrested after a vehicle search. The arrests were for PWITS class A &amp; possession of an offensive weapon. A number of items seized including those pictured. ^5680U #stopandsearch https://t.co/fPw67v5xNl,2020-12-06 07:25:59 MetTaskforce 1335485624355344384 0.jpg
12/06/2020 07:25:59,2020-12-06 07:25:59Z,2020-12-06 07:25:59,https://pbs.twimg.com/media/EoiZGF6WMAAGte8.jpg,1335485624355344384,1335485619460517888,1,4871511149,MetTaskforce,https://twitter.com/MetTaskforce/status/1335485624355344384,#TSG A busy night shift comes to an end for U54. First stop of the night on @MPSWandsworth saw 4 arrested after a vehicle search. The arrests were for PWITS class A &amp; possession of an offensive weapon. A number of items seized including those pictured. ^5680U #stopandsearch https://t.co/fPw67v5xNl,2020-12-06 07:25:59 MetTaskforce 1335485624355344384 1.jpg
12/05/2020 05:48:53,2020-12-05 05:48:53Z,2020-12-05 05:48:53,https://pbs.twimg.com/media/Eoc5R_GXEAAXznx.jpg,1335098801418342405,1335098795697311744,0,4871511149,MetTaskforce,https://twitter.com/MetTaskforce/status/1335098801418342405,#TSG A proactive traffic stop by U544 on Trinity Road @MPSWandsworth where two occupants of a vehicle were searched and found in possession of the below knife and controlled drugs. Both were arrested. #stopandsearch ^5680U https://t.co/OVNostYS5c,2020-12-05 05:48:53 MetTaskforce 1335098801418342405 0.jpg
12/04/2020 23:28:40,2020-12-04 23:28:40Z,2020-12-04 11:28:40,https://pbs.twimg.com/media/EobiJI1XUAEC_GV.jpg,1335003114873753601,1335002986179940353,0,4871511149,MetTaskforce,https://twitter.com/MetTaskforce/status/1335003114873753601,"Vehicle observed driving erratically at speed on @MPSWandsworth. Driver attempted to escape from officers. Swiftly detained. Knife concealed as a cane and lock knife found. Vehicle stolen, with driver being disqualified and having no insurance. Arrested. #Stopandsearch ^ 5268U https://t.co/iNcmEKfiaC",2020-12-04 11:28:40 MetTaskforce 1335003114873753601 0.jpg
12/04/2020 23:28:40,2020-12-04 23:28:40Z,2020-12-04 11:28:40,https://pbs.twimg.com/media/EobiJI3W4AEFzRg.jpg,1335003114873753601,1335002986188300289,1,4871511149,MetTaskforce,https://twitter.com/MetTaskforce/status/1335003114873753601,"Vehicle observed driving erratically at speed on @MPSWandsworth. Driver attempted to escape from officers. Swiftly detained. Knife concealed as a cane and lock knife found. Vehicle stolen, with driver being disqualified and having no insurance. Arrested. #Stopandsearch ^ 5268U https://t.co/iNcmEKfiaC",2020-12-04 11:28:40 MetTaskforce 1335003114873753601 1.jpg
12/01/2020 19:15:19,2020-12-01 19:15:19Z,2020-12-01 07:15:19,https://pbs.twimg.com/media/EoLLf3yXcAMFLir.jpg,1333852192546156547,1333852188066672643,0,4871511149,MetTaskforce,https://twitter.com/MetTaskforce/status/1333852192546156547,"#TSG #U52 have been on robbery patrols of @MPSWandsworth this evening. We’ve just arrested a male for possessing a knife, after we found this after a foot chase. https://t.co/uxrTGE1ziH",2020-12-01 07:15:19 MetTaskforce 1333852192546156547 0.jpg
11/29/2020 03:08:17,2020-11-29 03:08:17Z,2020-11-29 03:08:17,https://pbs.twimg.com/media/En9a-6cXIAABIqe.jpg,1332884057093529601,1332884051611557888,0,4871511149,MetTaskforce,https://twitter.com/MetTaskforce/status/1332884057093529601,A busy set of shifts continue on @MPSWandsworth with two males arrested for drug supply and this knife being recovered by U5:1. #stopandsearch https://t.co/ioVC8bGg1l,2020-11-29 03:08:17 MetTaskforce 1332884057093529601 0.jpg
11/27/2020 17:18:41,2020-11-27 17:18:41Z,2020-11-27 05:18:41,https://pbs.twimg.com/media/En2KcEeXEAAmsiT.jpg,1332373289667276802,1332373279613587456,0,4871511149,MetTaskforce,https://twitter.com/MetTaskforce/status/1332373289667276802,"#TSG #U31 are offering free gift wrap this #Christmas. Another two arrests from a positive #stopandsearch in #Hackney #E5 @MPSHackney. Plus a pack of #crack &amp; #heroin. Another hunting #knife off of the streets. Sorry no decent  pic, it’s packaged for forensics ^U311 #gangs https://t.co/ZASCQh5wmh",2020-11-27 05:18:41 MetTaskforce 1332373289667276802 0.jpg
11/26/2020 07:22:08,2020-11-26 07:22:08Z,2020-11-26 07:22:08,https://pbs.twimg.com/media/Enu4UG6XcAIc59X.jpg,1331860775942713345,1331860770410426370,0,4871511149,MetTaskforce,https://twitter.com/MetTaskforce/status/1331860775942713345,"Early morning start for TSG U44 this morning assisting @LambethMPS executing drugs warrants. 1 suspect arrested after this haul was found, including a nasty weapon! ^4717U #TheEarlyBirdCatchesTheWorm 🦅🪱 https://t.co/TWlvvLMtqM",2020-11-26 07:22:08 MetTaskforce 1331860775942713345 0.jpg
11/25/2020 16:19:03,2020-11-25 16:19:03Z,2020-11-25 04:19:03,https://pbs.twimg.com/media/EnrpnYGWEAAZSIf.jpg,1331633508096339971,1331633502534635520,0,4871511149,MetTaskforce,https://twitter.com/MetTaskforce/status/1331633508096339971,#TSG #U31 another #positive #stopandsearch #arrest in #Hackney #E5. Another two teenagers tried to run away from us. One had this combat #knife. This is why we do it. ^U311 @MPSHackney https://t.co/2NtEHUso7e,2020-11-25 04:19:03 MetTaskforce 1331633508096339971 0.jpg
11/24/2020 19:09:37,2020-11-24 19:09:37Z,2020-11-24 07:09:37,https://pbs.twimg.com/media/EnnHEJKXIAEceAz.jpg,1331314045820022788,1331314038857474049,0,4871511149,MetTaskforce,https://twitter.com/MetTaskforce/status/1331314045820022788,#TSG #U31 positive #stopandsearch #arrest in #Hackney #E5. 2 teenagers tried to run away from us. 1 had this machete down his tracksuit bottoms. This is why we do it. @MPSHackney ^U311 https://t.co/6ga7mltHKe,2020-11-24 07:09:37 MetTaskforce 1331314045820022788 0.jpg
11/24/2020 08:48:12,2020-11-24 08:48:12Z,2020-11-24 08:48:12,https://pbs.twimg.com/media/Enk41gEWEAAksOe.jpg,1331157660243267585,1331157656657072128,0,4871511149,MetTaskforce,https://twitter.com/MetTaskforce/status/1331157660243267585,"Call on @MPSHillingdon about an assault in progress where the alleged suspects threatened to stab the victim. #TSG officers from U24 assisted and detained the males. Upon searching their vehicle this was found in the boot #KnivesRuinLives 
^2842U https://t.co/ltnMrnknQw",2020-11-24 08:48:12 MetTaskforce 1331157660243267585 0.jpg
11/20/2020 15:23:31,2020-11-20 15:23:31Z,2020-11-20 03:23:31,https://pbs.twimg.com/media/EnRs9cuXYAEBNpZ.jpg,1329807595092238337,1329807592919621633,0,4871511149,MetTaskforce,https://twitter.com/MetTaskforce/status/1329807595092238337,TSG U22 out in @MPSBrent &amp; @MPSBarnet today working with @BTPLondon at Kilburn Overground Station. Eagle eyed TSG officers saw a male acting suspiciously and found this during their stop &amp; search. 1 Male arrested! #StopAndSearchWorks #knifecrime https://t.co/bZdR2FIigE,2020-11-20 03:23:31 MetTaskforce 1329807595092238337 0.jpg
11/15/2020 06:26:03,2020-11-15 06:26:03Z,2020-11-15 06:26:03,https://pbs.twimg.com/media/Em2B_ecW8AIGUn0.jpg,1327860397681020931,1327860392647913474,0,4871511149,MetTaskforce,https://twitter.com/MetTaskforce/status/1327860397681020931,"Numerous calls to #Dalgarno Estate on @MPSKenChel - 30 young males with knives/weapons, fighting + causing damage to vehicle. 7 arrests by TSG U53 for Drugs Supply, Off Wep + Violent Disorder. Rambo knife found on male. 2 baseball bats and knife found. A life saved tonight ^5268U https://t.co/Q03MBqFdUF",2020-11-15 06:26:03 MetTaskforce 1327860397681020931 0.jpg
11/12/2020 00:51:27,2020-11-12 00:51:27Z,2020-11-12 12:51:27,https://pbs.twimg.com/media/EmlYovYXMAIdyfG.jpg,1326689028444479488,1326689022173982722,0,4871511149,MetTaskforce,https://twitter.com/MetTaskforce/status/1326689028444479488,TSG U44 conducted stop &amp; search on 2 separate males with one in possession of a nasty knife. However what they both had in common was they thought concealing drugs in a rather sensitive area would stop officers finding them! Two arrested &amp; Class A drugs off the street ^4717U https://t.co/e872aXbmZp,2020-11-12 12:51:27 MetTaskforce 1326689028444479488 0.jpg
11/09/2020 14:40:55,2020-11-09 14:40:55Z,2020-11-09 02:40:55,https://pbs.twimg.com/media/EmY5t_xWMAEsTJa.jpg,1325810604783886336,1325810602682494977,0,4871511149,MetTaskforce,https://twitter.com/MetTaskforce/status/1325810604783886336,"TSG U222 tasked to conduct plain clothed Counter Terrorism patrols in @ealingMPS today. Officers spotted 3 males acting suspiciously who made off when approached, one youth caught and found in possession of this nasty weapon! 1 Arrested #StopAndSearchWorks #knifefree #knifecrime https://t.co/H7OLVsDCdF",2020-11-09 02:40:55 MetTaskforce 1325810604783886336 0.jpg
11/09/2020 13:33:36,2020-11-09 13:33:36Z,2020-11-09 01:33:36,https://pbs.twimg.com/media/EmYqTkEWMAMDGss.jpg,1325793664552083456,1325793655894978563,0,4871511149,MetTaskforce,https://twitter.com/MetTaskforce/status/1325793664552083456,"TSG U44 finished a successful week of Commissioners Reserve shifts yesterday. Over the week we made 25 arrests, with a number of knives, drugs, 2 loaded firearms and approximately £25k taken off the streets! Now for some well earned rest before doing it all again 💪🏼 ^4717U https://t.co/D8wukB0Q53",2020-11-09 01:33:36 MetTaskforce 1325793664552083456 0.jpg
11/08/2020 16:47:29,2020-11-08 16:47:29Z,2020-11-08 04:47:29,https://pbs.twimg.com/media/EmUNGFiW4AY0vRp.jpg,1325480068316098560,1325480063547138054,0,4871511149,MetTaskforce,https://twitter.com/MetTaskforce/status/1325480068316098560,"Vehicle stop by TSG U53 officers on @MPSMerton resulted in 3 arrests for Offensive Weapon, Points/Blades, Class A drugs, Taking a Vehicle and No Insurance. Sharpened screw driver and Stanley knife ready to use, with no excuse provided. All well known for burglary and theft ^5268U https://t.co/cySexarvaV",2020-11-08 04:47:29 MetTaskforce 1325480068316098560 0.jpg
11/08/2020 16:47:29,2020-11-08 16:47:29Z,2020-11-08 04:47:29,https://pbs.twimg.com/media/EmUNGFgXMAAJ9cJ.jpg,1325480068316098560,1325480063538769920,1,4871511149,MetTaskforce,https://twitter.com/MetTaskforce/status/1325480068316098560,"Vehicle stop by TSG U53 officers on @MPSMerton resulted in 3 arrests for Offensive Weapon, Points/Blades, Class A drugs, Taking a Vehicle and No Insurance. Sharpened screw driver and Stanley knife ready to use, with no excuse provided. All well known for burglary and theft ^5268U https://t.co/cySexarvaV",2020-11-08 04:47:29 MetTaskforce 1325480068316098560 1.jpg
11/07/2020 18:33:23,2020-11-07 18:33:23Z,2020-11-07 06:33:23,https://pbs.twimg.com/media/EmPbvTVW8AA6a8u.jpg,1325144332102348800,1325144321067249664,0,4871511149,MetTaskforce,https://twitter.com/MetTaskforce/status/1325144332102348800,"TSG U44 spotted two suspicious males on pedal cycles in @MPSLewisham. They tried to evade officers but our driver was better, stopped &amp; searched and found to be concealing cannabis and this nasty knife on themselves! Custody space for 2 and a nasty weapon off the street 💪🏼 ^4717U https://t.co/oe7WtXUjzv",2020-11-07 06:33:23 MetTaskforce 1325144332102348800 0.jpg
11/05/2020 00:32:21,2020-11-05 00:32:21Z,2020-11-05 12:32:21,https://pbs.twimg.com/media/EmBRIynXYAUBYM3.jpg,1324147507677569024,1324147501914611717,0,4871511149,MetTaskforce,https://twitter.com/MetTaskforce/status/1324147507677569024,"TSG U24 patrolling Cambridge Avenue NW6 on @MPSBarnet stopped and searched a 17 year old who was found with this in his possession.
#StopAndSearch #KnivesRuinLives https://t.co/DEVMyhD1oZ",2020-11-05 12:32:21 MetTaskforce 1324147507677569024 0.jpg
11/03/2020 23:12:13,2020-11-03 23:12:13Z,2020-11-03 11:12:13,https://pbs.twimg.com/media/El71NV0XgAYve4r.jpg,1323764952159629314,1323764950037397510,0,4871511149,MetTaskforce,https://twitter.com/MetTaskforce/status/1323764952159629314,"TSG U22 assisted @MPSBarnet with an incident this evening whereby a suspect threatened to stab a victim. Upon seeing Police, the suspect ran but swiftly detained! This weapon &amp; a large amount of Class A drugs found on the suspect, male arrested! #knivesout #TSG https://t.co/Z82b0YTUsd",2020-11-03 11:12:13 MetTaskforce 1323764952159629314 0.jpg
11/02/2020 19:40:31,2020-11-02 19:40:31Z,2020-11-02 07:40:31,https://pbs.twimg.com/media/El17JqKXgAA0tou.jpg,1323349289242906631,1323349271383605248,0,4871511149,MetTaskforce,https://twitter.com/MetTaskforce/status/1323349289242906631,"TSG U44 are off to a flying start for their week of Late Turn Commissioners Reserve. Suspicious male seen whilst patrolling @MPSSouthwark, tried to discard this nasty knife but wasn’t quick enough! One male arrested #StopAndSearchWorks ^4717U https://t.co/JH7i9F8vrZ",2020-11-02 07:40:31 MetTaskforce 1323349289242906631 0.jpg
11/01/2020 22:29:16,2020-11-01 22:29:16Z,2020-11-01 10:29:16,https://pbs.twimg.com/media/ElxYMbFXEAI8uZN.jpg,1323029366130069508,1323029360991997954,0,4871511149,MetTaskforce,https://twitter.com/MetTaskforce/status/1323029366130069508,"#TSG #U31 are ending our late turn week of Commissioner’s Reserve covering @MPSTowerHam @MPSHackney. 120 #stopandsearch Positive outcome rate 30%. Drug dealers, violent criminals, offensive weapon carriers, and thieves all arrested courtesy of our eagle eyes ^U311 https://t.co/E5jr1So1v7",2020-11-01 10:29:16 MetTaskforce 1323029366130069508 0.jpg
10/29/2020 01:35:50,2020-10-29 01:35:50Z,2020-10-29 01:35:50,https://pbs.twimg.com/media/EldciRYXYAEBlUb.jpg,1321626765471735809,1321626759507435521,0,4871511149,MetTaskforce,https://twitter.com/MetTaskforce/status/1321626765471735809,"TSG U413 conducted a stop and search of a male on a bicycle in @MPSLewisham. On him they found a knife, balaclava and gloves. Clearly got the wrong dress code for an early trick or treating. Arrested for possession of an offensive weapon #stopandsearch ^4653U https://t.co/mnAeVasW71",2020-10-29 01:35:50 MetTaskforce 1321626765471735809 0.jpg
10/29/2020 01:35:50,2020-10-29 01:35:50Z,2020-10-29 01:35:50,https://pbs.twimg.com/media/EldciRZXYAMtGLr.jpg,1321626765471735809,1321626759511629827,1,4871511149,MetTaskforce,https://twitter.com/MetTaskforce/status/1321626765471735809,"TSG U413 conducted a stop and search of a male on a bicycle in @MPSLewisham. On him they found a knife, balaclava and gloves. Clearly got the wrong dress code for an early trick or treating. Arrested for possession of an offensive weapon #stopandsearch ^4653U https://t.co/mnAeVasW71",2020-10-29 01:35:50 MetTaskforce 1321626765471735809 1.jpg
10/29/2020 01:35:50,2020-10-29 01:35:50Z,2020-10-29 01:35:50,https://pbs.twimg.com/media/EldciRUXEAAU1ek.jpg,1321626765471735809,1321626759490637824,2,4871511149,MetTaskforce,https://twitter.com/MetTaskforce/status/1321626765471735809,"TSG U413 conducted a stop and search of a male on a bicycle in @MPSLewisham. On him they found a knife, balaclava and gloves. Clearly got the wrong dress code for an early trick or treating. Arrested for possession of an offensive weapon #stopandsearch ^4653U https://t.co/mnAeVasW71",2020-10-29 01:35:50 MetTaskforce 1321626765471735809 2.jpg
10/29/2020 01:23:30,2020-10-29 01:23:30Z,2020-10-29 01:23:30,https://pbs.twimg.com/media/EldZtfSW0AUax0l.jpg,1321623660961161222,1321623653684006917,0,4871511149,MetTaskforce,https://twitter.com/MetTaskforce/status/1321623660961161222,TSG U414 attended a call in @MPSSouthwark to a large group of people shooting fireworks at people and passing vehicles. One of those stopped found with these fireworks and large wooden pole. Arrested for throwing fireworks and offensive weapon. #spaceforone ^4653U https://t.co/OEfsHn8lUB,2020-10-29 01:23:30 MetTaskforce 1321623660961161222 0.jpg
10/29/2020 01:23:30,2020-10-29 01:23:30Z,2020-10-29 01:23:30,https://pbs.twimg.com/media/EldZtfSWoAA7TQ0.jpg,1321623660961161222,1321623653683994624,1,4871511149,MetTaskforce,https://twitter.com/MetTaskforce/status/1321623660961161222,TSG U414 attended a call in @MPSSouthwark to a large group of people shooting fireworks at people and passing vehicles. One of those stopped found with these fireworks and large wooden pole. Arrested for throwing fireworks and offensive weapon. #spaceforone ^4653U https://t.co/OEfsHn8lUB,2020-10-29 01:23:30 MetTaskforce 1321623660961161222 1.jpg
10/27/2020 20:25:37,2020-10-27 20:25:37Z,2020-10-27 08:25:37,https://pbs.twimg.com/media/ElXL8YGW0AIm1yP.jpg,1321186309701013504,1321186303824809986,0,4871511149,MetTaskforce,https://twitter.com/MetTaskforce/status/1321186309701013504,TSG U414 conducted a vehicle stop in @MPSKnightsHill ward on Lambeth Borough. The three occupants were searched and under the passenger seat this knife was found. Drugs were also found in and outside the car. #spaceforthree ^4653U https://t.co/RxGK9x44b5,2020-10-27 08:25:37 MetTaskforce 1321186309701013504 0.jpg
10/27/2020 20:00:09,2020-10-27 20:00:09Z,2020-10-27 08:00:09,https://pbs.twimg.com/media/ElXFyImXgAIWWdj.jpg,1321179901186158607,1321179530795646978,0,4871511149,MetTaskforce,https://twitter.com/MetTaskforce/status/1321179901186158607,U43 are back from their travels in East London and have hit the ground running on @MPSSouthwark. Proactive patrols around the #SilwoodEstate #SE16 led to the arrest of a 16yr old male with this blade after he tried to make off. #StopAndSearch #KnivesTakeLives ^4823U https://t.co/aRI8YeuQIl,2020-10-27 08:00:09 MetTaskforce 1321179901186158607 0.jpg
10/26/2020 23:16:53,2020-10-26 23:16:53Z,2020-10-26 11:16:53,https://pbs.twimg.com/media/ElSpjYiWoAA4QVf.jpg,1320867023572914182,1320867016073453568,0,4871511149,MetTaskforce,https://twitter.com/MetTaskforce/status/1320867023572914182,#TSG #U31 we’re late turn Commissioner’s Reserve at Waltham Forest @MPSWForest. #Stopandsearch in #Leyton #E10 for possession of these weapons. #knife ^U311 https://t.co/SxVWZ3C4ou,2020-10-26 11:16:53 MetTaskforce 1320867023572914182 0.jpg
10/17/2020 05:08:46,2020-10-17 05:08:46Z,2020-10-17 05:08:46,https://pbs.twimg.com/media/EkgaKV7W0AAu0aQ.jpg,1317331700289032198,1317331655992987648,0,4871511149,MetTaskforce,https://twitter.com/MetTaskforce/status/1317331700289032198,Vehicle stop in Clapham by TSG U53 whilst patrolling @LambethMPS. Male known for serious armed robbery detained for search for weapons. Lock knife found concealed in pants. Stab vest found in boot. We continue to work hard to try to keep the streets safe. ^ 5268U #StopAndSearch https://t.co/0ZiRVSMSb5,2020-10-17 05:08:46 MetTaskforce 1317331700289032198 0.jpg
10/16/2020 09:16:57,2020-10-16 09:16:57Z,2020-10-16 09:16:57,https://pbs.twimg.com/media/EkcJaXMXUAEBUmq.jpg,1317031770290900992,1317031764536283137,0,4871511149,MetTaskforce,https://twitter.com/MetTaskforce/status/1317031770290900992,"3 young males with links to gangs stopped by TSG U53 on @LambethMPS last night in secluded car park. Strong smell of cannabis. Detained for drugs searches. Found in possession of Flick Knife, Lock Knife and 15-20 wraps of believed Crack Cocaine. All arrested ^5268U #StopAndSearch https://t.co/Duh3Y9GIjn",2020-10-16 09:16:57 MetTaskforce 1317031770290900992 0.jpg
10/16/2020 09:16:57,2020-10-16 09:16:57Z,2020-10-16 09:16:57,https://pbs.twimg.com/media/EkcJaXLWMAE-GJz.jpg,1317031770290900992,1317031764532015105,1,4871511149,MetTaskforce,https://twitter.com/MetTaskforce/status/1317031770290900992,"3 young males with links to gangs stopped by TSG U53 on @LambethMPS last night in secluded car park. Strong smell of cannabis. Detained for drugs searches. Found in possession of Flick Knife, Lock Knife and 15-20 wraps of believed Crack Cocaine. All arrested ^5268U #StopAndSearch https://t.co/Duh3Y9GIjn",2020-10-16 09:16:57 MetTaskforce 1317031770290900992 1.jpg
10/10/2020 20:21:36,2020-10-10 20:21:36Z,2020-10-10 08:21:36,https://pbs.twimg.com/media/Ej_n_R8XgAAJ3ru.jpg,1315024705393496064,1315024690549850112,0,4871511149,MetTaskforce,https://twitter.com/MetTaskforce/status/1315024705393496064,"TSG U44 strike again! Whilst conducting proactive patrols in Hackney after a recent stabbing, officers had cause to stop a suspicious vehicle. Occupants searched &amp; this nasty weapon was found concealed in the suspect’s shoe! #StopandSearchWorks ^4717U https://t.co/CYGzzcVAHk",2020-10-10 08:21:36 MetTaskforce 1315024705393496064 0.jpg
10/10/2020 17:12:26,2020-10-10 17:12:26Z,2020-10-10 05:12:26,https://pbs.twimg.com/media/Ej-8sdoXsAMrl3R.jpg,1314977098466054144,1314977088269692931,0,4871511149,MetTaskforce,https://twitter.com/MetTaskforce/status/1314977098466054144,"Whilst on patrol in Hackney last night, TSG U44 stopped &amp; searched a vehicle &amp; its occupants. Something wasn’t quite right &amp; a further search of their address after arrest revealed £10k cash, a large amount of Class A &amp; B drugs and these nasty weapons! #StopandSearchWorks ^4717U https://t.co/700TvbUNt4",2020-10-10 05:12:26 MetTaskforce 1314977098466054144 0.jpg
10/04/2020 23:14:54,2020-10-04 23:14:54Z,2020-10-04 11:14:54,https://pbs.twimg.com/media/EjhWHkxWkAEt01R.jpg,1312893990178639873,1312893979508248577,0,4871511149,MetTaskforce,https://twitter.com/MetTaskforce/status/1312893990178639873,#TSG #U31 #stopandsearch in #WalthamForest #E4 one male arrested for possession of this lock #knife. #SarahSays “Always nice to get a knife.” #MondayMotivation @MPSWForest ^U311 https://t.co/oA4JvWgNXP,2020-10-04 11:14:54 MetTaskforce 1312893990178639873 0.jpg
10/03/2020 16:42:56,2020-10-03 16:42:56Z,2020-10-03 04:42:56,https://pbs.twimg.com/media/Ejay0iuXYAEDxGU.jpg,1312432962206609410,1312432957169295361,0,4871511149,MetTaskforce,https://twitter.com/MetTaskforce/status/1312432962206609410,#U4.2 officers found 2 males hiding in a car last night in #MPSLewisham. This nasty knife was found in the central console plus class B drugs and money. Both males were arrested for numerous offences! To top it off the male in the drivers seat was also wanted #stopandsearch https://t.co/BXjXI3sxLm,2020-10-03 04:42:56 MetTaskforce 1312432962206609410 0.jpg
10/01/2020 20:49:55,2020-10-01 20:49:55Z,2020-10-01 08:49:55,https://pbs.twimg.com/media/EjRYK1qX0AEI09R.jpg,1311770340532654084,1311770334698393601,0,4871511149,MetTaskforce,https://twitter.com/MetTaskforce/status/1311770340532654084,TSG U53 are out in @LambethMPS  on patrol with a new intake of #streetduties students after their input with @dwaynamics earlier on this afternoon #stopandsearch #keepingKnivesOffTheStreets ^5853U https://t.co/QVN6Oxjdbb,2020-10-01 08:49:55 MetTaskforce 1311770340532654084 0.jpg
09/30/2020 07:59:07,2020-09-30 07:59:07Z,2020-09-30 07:59:07,https://pbs.twimg.com/media/EjJeKGCXkAEv6_g.jpg,1311213974713774080,1311213969030483969,0,4871511149,MetTaskforce,https://twitter.com/MetTaskforce/status/1311213974713774080,"Last night TSG U533 stopped a vehicle in @LambethMPS We had cause to search the driver and vehicle and a large amount of cash, multiple, constantly ringing burner phones and this nasty bar were found. Arrested for Concerned in Supply and Possession of Offensive Weapon ^5853U https://t.co/ZwHzCLwDj5",2020-09-30 07:59:07 MetTaskforce 1311213974713774080 0.jpg
09/29/2020 12:47:44,2020-09-29 12:47:44Z,2020-09-29 12:47:44,https://pbs.twimg.com/media/EjFWnt2WoAItuhv.jpg,1310924218226356224,1310924206863982594,0,4871511149,MetTaskforce,https://twitter.com/MetTaskforce/status/1310924218226356224,U43 have been clocking up the miles recently. Arrests for GBH &amp; weapons &amp; disrupting a prostitution ring in #BOW have kept us busy. While in #Isleworth @NCA_UK warrants led to arrests for class A drugs supply offences. #VarietyIsTheSpiceOfLife #KeepOnTruckin ^4823U https://t.co/NcrJ34cSfk,2020-09-29 12:47:44 MetTaskforce 1310924218226356224 0.jpg
09/29/2020 12:47:44,2020-09-29 12:47:44Z,2020-09-29 12:47:44,https://pbs.twimg.com/media/EjFWn-JX0AAmSZN.jpg,1310924218226356224,1310924211238719488,1,4871511149,MetTaskforce,https://twitter.com/MetTaskforce/status/1310924218226356224,U43 have been clocking up the miles recently. Arrests for GBH &amp; weapons &amp; disrupting a prostitution ring in #BOW have kept us busy. While in #Isleworth @NCA_UK warrants led to arrests for class A drugs supply offences. #VarietyIsTheSpiceOfLife #KeepOnTruckin ^4823U https://t.co/NcrJ34cSfk,2020-09-29 12:47:44 MetTaskforce 1310924218226356224 1.jpg
09/29/2020 12:47:44,2020-09-29 12:47:44Z,2020-09-29 12:47:44,https://pbs.twimg.com/media/EjFWoMdWoAUgDT5.jpg,1310924218226356224,1310924215080624133,2,4871511149,MetTaskforce,https://twitter.com/MetTaskforce/status/1310924218226356224,U43 have been clocking up the miles recently. Arrests for GBH &amp; weapons &amp; disrupting a prostitution ring in #BOW have kept us busy. While in #Isleworth @NCA_UK warrants led to arrests for class A drugs supply offences. #VarietyIsTheSpiceOfLife #KeepOnTruckin ^4823U https://t.co/NcrJ34cSfk,2020-09-29 12:47:44 MetTaskforce 1310924218226356224 2.jpg
09/26/2020 18:51:44,2020-09-26 18:51:44Z,2020-09-26 06:51:44,https://pbs.twimg.com/media/Ei3NK1XWkAIPs3d.jpg,1309928658916855808,1309928652642095106,0,4871511149,MetTaskforce,https://twitter.com/MetTaskforce/status/1309928658916855808,"#TSG Great effort by officers from U545 and dog unit T07 after a vehicle made off from them on Clapham Road @LambethMPS. All occupants decamped, chased, detained &amp; arrested for multiple offences; including possession of the below locking knife found by PD Riggs 🐶🔪🎾 ^5680U https://t.co/w9wNlsPQGJ",2020-09-26 06:51:44 MetTaskforce 1309928658916855808 0.jpg
09/24/2020 01:31:14,2020-09-24 01:31:14Z,2020-09-24 01:31:14,https://pbs.twimg.com/media/EipL1pjXsAA2QZ8.jpg,1308942032304508928,1308942026763907072,0,4871511149,MetTaskforce,https://twitter.com/MetTaskforce/status/1308942032304508928,"TSG U22 assisted @MPSEnfield today with school robbery patrols responded to a knife point robbery at Albany Park, EN3. Area search resulted in a foot chase of suspect, TSG officers swiftly detained him &amp; found this nasty weapon discarded! 2 arrested! #Enfield #knifefree https://t.co/VoN1XFfGgW",2020-09-24 01:31:14 MetTaskforce 1308942032304508928 0.jpg
09/22/2020 17:18:53,2020-09-22 17:18:53Z,2020-09-22 05:18:53,https://pbs.twimg.com/media/EiiRW3uWkAAPkMm.jpg,1308455740747771904,1308455513852645376,0,4871511149,MetTaskforce,https://twitter.com/MetTaskforce/status/1308455740747771904,#U52 are late turn commissioners reserve posted to @LambethMPS this week. Officer chases a 16 year old who makes off in #WiltshireRoadSW9 where he is then found in possession of this knife! Hopefully we’ve prevented an injury or worse today. #stopandsearch #TSG https://t.co/siY37Xv9mM,2020-09-22 05:18:53 MetTaskforce 1308455740747771904 0.jpg
09/21/2020 16:26:10,2020-09-21 16:26:10Z,2020-09-21 04:26:10,https://pbs.twimg.com/media/Eic755qXcAUWR6C.jpg,1308080086495760386,1308080082691518469,0,4871511149,MetTaskforce,https://twitter.com/MetTaskforce/status/1308080086495760386,U4.2 have started their crime posting today. This is a week of proactive intelligence led Policing. A male tried to run from officers in Tower Hamlets today but was not quick enough on his feet! Male found with this nasty knife on his person! One arrested! 4333U https://t.co/Sn7VtdqqLN,2020-09-21 04:26:10 MetTaskforce 1308080086495760386 0.jpg
09/20/2020 03:27:48,2020-09-20 03:27:48Z,2020-09-20 03:27:48,https://pbs.twimg.com/media/EiVAKVOWkAkVzAe.jpg,1307521818845159425,1307521813061210121,0,4871511149,MetTaskforce,https://twitter.com/MetTaskforce/status/1307521818845159425,U3:3 stopped known gang members on shoreditch high street this evening on @MPSHackney in possession of these nasty weapons. Off to custody they went and more knives off the streets of london ^3510U #3TSG #StopandSearch #Taskforce https://t.co/Y0nhVGxofz,2020-09-20 03:27:48 MetTaskforce 1307521818845159425 0.jpg
09/20/2020 03:27:48,2020-09-20 03:27:48Z,2020-09-20 03:27:48,https://pbs.twimg.com/media/EiVAKVZXsAABOum.jpg,1307521818845159425,1307521813107421184,1,4871511149,MetTaskforce,https://twitter.com/MetTaskforce/status/1307521818845159425,U3:3 stopped known gang members on shoreditch high street this evening on @MPSHackney in possession of these nasty weapons. Off to custody they went and more knives off the streets of london ^3510U #3TSG #StopandSearch #Taskforce https://t.co/Y0nhVGxofz,2020-09-20 03:27:48 MetTaskforce 1307521818845159425 1.jpg
09/19/2020 02:22:10,2020-09-19 02:22:10Z,2020-09-19 02:22:10,https://pbs.twimg.com/media/EiPnjCLXcAAFDT_.jpg,1307142910736052225,1307142905933557760,0,4871511149,MetTaskforce,https://twitter.com/MetTaskforce/status/1307142910736052225,"U3:3 with another stop search in the Hoxton area of @MPSHackney. One male with these blades and a female who tried to lie about who she was, she was wanted and will be off to court in the morning. ^3510U #TSG #StopandSearch https://t.co/ByuQsh3snJ",2020-09-19 02:22:10 MetTaskforce 1307142910736052225 0.jpg
09/18/2020 23:52:13,2020-09-18 23:52:13Z,2020-09-18 11:52:13,https://pbs.twimg.com/media/EiPFOptXYAA2NqQ.jpg,1307105177535680512,1307105172372545536,0,4871511149,MetTaskforce,https://twitter.com/MetTaskforce/status/1307105177535680512,U33 and U32 started the night stopping a robbery team heading out to work in @MPSRedbridge #NoExcuses #saynotoknives #3TSG #Taskforce ^3181U https://t.co/dCKKop7UFQ,2020-09-18 11:52:13 MetTaskforce 1307105177535680512 0.jpg
09/18/2020 08:01:54,2020-09-18 08:01:54Z,2020-09-18 08:01:54,https://pbs.twimg.com/media/EiLrt62WAAA2W-G.jpg,1306866020993425408,1306866016014696448,0,4871511149,MetTaskforce,https://twitter.com/MetTaskforce/status/1306866020993425408,"TSG U53 Crime posting on @MPSSouthwark - drugs warrant conducted at drug dealing address.
4 arrested for Being Concerned in Supply of Drugs. Weapons found at address. Closure Notice issued, at court today applying for extension ^ 5268U. https://t.co/NLIWjz6VLP",2020-09-18 08:01:54 MetTaskforce 1306866020993425408 0.jpg
09/18/2020 00:50:28,2020-09-18 00:50:28Z,2020-09-18 12:50:28,https://pbs.twimg.com/media/EiKI7zHWoAA-xnk.jpg,1306757446627713026,1306757402805575680,0,4871511149,MetTaskforce,https://twitter.com/MetTaskforce/status/1306757446627713026,U3:3 with another positive stop search on @MPSNewham. One male stopped with this nasty lock knife and another with Class A drugs. Space for two! Another nasty knife off the streets of london. Stop search works! #TSG #StopandSearch https://t.co/oYECmUzhKt,2020-09-18 12:50:28 MetTaskforce 1306757446627713026 0.jpg
09/16/2020 13:23:23,2020-09-16 13:23:23Z,2020-09-16 01:23:23,https://pbs.twimg.com/media/EiCiHBHXsAU8JvI.jpg,1306222149238247424,1306222133379575813,0,4871511149,MetTaskforce,https://twitter.com/MetTaskforce/status/1306222149238247424,"Another stop &amp; search, another arrest, for possessing a knife by #TSG #U52 while continuing their patrols of @LambethMPS https://t.co/6s0vpDWA9e",2020-09-16 01:23:23 MetTaskforce 1306222149238247424 0.jpg
09/16/2020 10:08:57,2020-09-16 10:08:57Z,2020-09-16 10:08:57,https://pbs.twimg.com/media/EiB1mpoWkAU7cWS.jpg,1306173220052140035,1306173198808027141,0,4871511149,MetTaskforce,https://twitter.com/MetTaskforce/status/1306173220052140035,"#TSG #U52 have been out on @LambethMPS this morning. We’ve arrested a male, in possession of this knife, after a stop &amp; search on Coldharbour Lane. https://t.co/GSS47vtdZ3",2020-09-16 10:08:57 MetTaskforce 1306173220052140035 0.jpg
09/14/2020 13:51:19,2020-09-14 13:51:19Z,2020-09-14 01:51:19,https://pbs.twimg.com/media/Eh4VVINXYAAWmlS.jpg,1305504405240852480,1305504394709000192,0,4871511149,MetTaskforce,https://twitter.com/MetTaskforce/status/1305504405240852480,"#TSG #U31 #Walthamstow #E17 #Stopandsearch. Two baddies arrested, this #knife recovered. This is why we keep doing it 🦂 @MPSWForest ^3021 https://t.co/Ga09lXjNAk",2020-09-14 01:51:19 MetTaskforce 1305504405240852480 0.jpg
09/14/2020 06:02:23,2020-09-14 06:02:23Z,2020-09-14 06:02:23,https://pbs.twimg.com/media/Eh2p_8tXkAEWXkC.jpg,1305386391350792193,1305386383100579841,0,4871511149,MetTaskforce,https://twitter.com/MetTaskforce/status/1305386391350792193,#TSG #U31 #Stopandsearch overnight in #EastHam #E6. 3 baddies nicked for a variety of offences including possession of #heroin &amp; this #knife.  @MPSNewham @MPSEastHamCntrl ^3021 https://t.co/2uJww6N9qC,2020-09-14 06:02:23 MetTaskforce 1305386391350792193 0.jpg
09/12/2020 14:43:27,2020-09-12 14:43:27Z,2020-09-12 02:43:27,https://pbs.twimg.com/media/EhuOFiAX0AArMr1.jpg,1304792746385969153,1304792742732746752,0,4871511149,MetTaskforce,https://twitter.com/MetTaskforce/status/1304792746385969153,#TSG #U31 #Stopandsearch #Leyton #E10. 16 year old suspect arrested with this awful #knife. This is why we do it. ^3021 @MPSWForest https://t.co/dUDcNisO3U,2020-09-12 02:43:27 MetTaskforce 1304792746385969153 0.jpg
09/11/2020 23:23:24,2020-09-11 23:23:24Z,2020-09-11 11:23:24,https://pbs.twimg.com/media/Ehq7gCnXYAEtG73.jpg,1304561208125722624,1304561201209368577,0,4871511149,MetTaskforce,https://twitter.com/MetTaskforce/status/1304561208125722624,Fortunately for #TSG #U34 the drug dealer we decided to #stopandsearch in #Leytonstone #E11 had forgotten to properly charge his #escooter 🛴 and was wearing sliders... he didn’t run 🏃🏻‍♂️ away very far. Another #knife off the street too @MPSWForest ^3021 https://t.co/FL7UMZhnRR,2020-09-11 11:23:24 MetTaskforce 1304561208125722624 0.jpg
09/11/2020 20:28:02,2020-09-11 20:28:02Z,2020-09-11 08:28:02,https://pbs.twimg.com/media/EhqTXF9WAAAtEDJ.jpg,1304517075562528769,1304517067022925824,0,4871511149,MetTaskforce,https://twitter.com/MetTaskforce/status/1304517075562528769,"TSG U53 patrols on @LambethMPS tackling knife crime, gang violence and robberies. 3 arrested for Offensive Weapon after this knife was found by PD Taz 🐕. #StopAndSearch #NoToKnives ^5268U https://t.co/BGDlQXh5Kg",2020-09-11 08:28:02 MetTaskforce 1304517075562528769 0.jpg
09/11/2020 09:55:21,2020-09-11 09:55:21Z,2020-09-11 09:55:21,https://pbs.twimg.com/media/EhoCjYXXsAEhbQc.jpg,1304357855282311168,1304357848936329217,0,4871511149,MetTaskforce,https://twitter.com/MetTaskforce/status/1304357855282311168,"U32 with another knife taken off the streets last night in @MPSWForest 
Habitual knife carrier spotted police &amp; decided to make off in his stolen rental vehicle before crashing.
Male detained and this nasty knife seen poking out of his man bag.
#knifecrime #droptheknife https://t.co/3MLgyL4waS",2020-09-11 09:55:21 MetTaskforce 1304357855282311168 0.jpg
09/08/2020 09:28:31,2020-09-08 09:28:31Z,2020-09-08 09:28:31,https://pbs.twimg.com/media/EhYfoxnWAAAMWId.jpg,1303263938507870208,1303263927543922688,0,4871511149,MetTaskforce,https://twitter.com/MetTaskforce/status/1303263938507870208,"Safely say this morning U32 saved a life yesterday afternoon. Whilst in @MPSHackney @hackneycouncil @MPSDalston three juveniles seen chasing another with these weapons in front of us.
With the assistance of local residents all males detained and arrested. https://t.co/0nK7FCbmYR",2020-09-08 09:28:31 MetTaskforce 1303263938507870208 0.jpg
09/08/2020 09:28:31,2020-09-08 09:28:31Z,2020-09-08 09:28:31,https://pbs.twimg.com/media/EhYfoxoXYAAjyhx.jpg,1303263938507870208,1303263927548207104,1,4871511149,MetTaskforce,https://twitter.com/MetTaskforce/status/1303263938507870208,"Safely say this morning U32 saved a life yesterday afternoon. Whilst in @MPSHackney @hackneycouncil @MPSDalston three juveniles seen chasing another with these weapons in front of us.
With the assistance of local residents all males detained and arrested. https://t.co/0nK7FCbmYR",2020-09-08 09:28:31 MetTaskforce 1303263938507870208 1.jpg
09/08/2020 09:28:31,2020-09-08 09:28:31Z,2020-09-08 09:28:31,https://pbs.twimg.com/media/EhYfoxnXgAovfIk.jpg,1303263938507870208,1303263927544021002,2,4871511149,MetTaskforce,https://twitter.com/MetTaskforce/status/1303263938507870208,"Safely say this morning U32 saved a life yesterday afternoon. Whilst in @MPSHackney @hackneycouncil @MPSDalston three juveniles seen chasing another with these weapons in front of us.
With the assistance of local residents all males detained and arrested. https://t.co/0nK7FCbmYR",2020-09-08 09:28:31 MetTaskforce 1303263938507870208 2.jpg
09/07/2020 13:55:31,2020-09-07 13:55:31Z,2020-09-07 01:55:31,https://pbs.twimg.com/media/EhUTK2UXkAIEIix.jpg,1302968746580025344,1302968744294191106,0,4871511149,MetTaskforce,https://twitter.com/MetTaskforce/status/1302968746580025344,"TSG U22 are in @MPSEnfield and @MPSHaringey today conducting proactive Robbery patrols around all schools. Whilst out on foot engaging with the local community, we found these nasty machetes hidden in Ponders End! Both seized and hopefully some lives saved! #knifecrime #London https://t.co/N9BM96BXo5",2020-09-07 01:55:31 MetTaskforce 1302968746580025344 0.jpg
09/05/2020 19:47:54,2020-09-05 19:47:54Z,2020-09-05 07:47:54,https://pbs.twimg.com/media/EhLQo8eWoAEwmzd.jpg,1302332650951245824,1302332644110278657,0,4871511149,MetTaskforce,https://twitter.com/MetTaskforce/status/1302332650951245824,U5:1 patrolling @MPSSouthwark as part of Commissioner Reserve week. One male stopped and found in possession of this knife. Male arrested. ^5027U https://t.co/CvUgJJquMv,2020-09-05 07:47:54 MetTaskforce 1302332650951245824 0.jpg
09/04/2020 11:13:17,2020-09-04 11:13:17Z,2020-09-04 11:13:17,https://pbs.twimg.com/media/EhERPxTXYAAw56y.jpg,1301840755124830208,1301840729917054976,0,4871511149,MetTaskforce,https://twitter.com/MetTaskforce/status/1301840755124830208,"#U42 starting their early turn shifts with a coffee, some oats and a pair of Nunchucks! A suspicious female on #Lewisham High Street was searched by officers and found to have these offensive weapons in her bag! One female arrested! https://t.co/7zN8f7wkBJ",2020-09-04 11:13:17 MetTaskforce 1301840755124830208 0.jpg
09/04/2020 03:13:48,2020-09-04 03:13:48Z,2020-09-04 03:13:48,https://pbs.twimg.com/media/EhCjhXwXcAQv2LA.jpg,1301720089939542018,1301720086017961988,0,4871511149,MetTaskforce,https://twitter.com/MetTaskforce/status/1301720089939542018,#TSG #U31 more overnight 😴 🌖#stopandsearch. One baddie arrested for having this #knife in #Walthamstow #E17 @MPSWForest ^3021 🦂 https://t.co/j4FVAttIwr,2020-09-04 03:13:48 MetTaskforce 1301720089939542018 0.jpg
09/02/2020 08:04:57,2020-09-02 08:04:57Z,2020-09-02 08:04:57,https://pbs.twimg.com/media/Eg5S-p_XsAU83IK.jpg,1301068582743400448,1301068578733666309,0,4871511149,MetTaskforce,https://twitter.com/MetTaskforce/status/1301068582743400448,#TSG U544/U547 were on patrols on @MPSSouthwark when a vehicle was stopped and occupant searched. Knife found and one male arrested for possession of points and blades and drug drive offences.  #stopandsearch ^5680U https://t.co/2VevlrUZJu,2020-09-02 08:04:57 MetTaskforce 1301068582743400448 0.jpg
09/01/2020 21:45:13,2020-09-01 21:45:13Z,2020-09-01 09:45:13,https://pbs.twimg.com/media/Eg3FIcuXgAM2ocA.jpg,1300912621399543812,1300912616320237571,0,4871511149,MetTaskforce,https://twitter.com/MetTaskforce/status/1300912621399543812,"Great work by @MPSNewham Response Team. They dealt with the secondary investigation, and charged for possession of an offensive #weapon. Next stop: court. #knife #stopandsearch #Newham #UptonPark #E6 #Teamwork ^3021 https://t.co/wGbxuITA1N",2020-09-01 09:45:13 MetTaskforce 1300912621399543812 0.jpg
09/01/2020 02:20:24,2020-09-01 02:20:24Z,2020-09-01 02:20:24,https://pbs.twimg.com/media/Egy6hdBWAAY7BtO.jpg,1300619484303183873,1300619476291944454,0,4871511149,MetTaskforce,https://twitter.com/MetTaskforce/status/1300619484303183873,"U5:1 carrying out anti robbery patrols on @MPSSouthwark . Two juveniles acting suspiciously stopped and searched, one found in possession of this knife, the other found with drugs. Both arrested and now in custody.
^5092U https://t.co/j14ZPpU1JW",2020-09-01 02:20:24 MetTaskforce 1300619484303183873 0.jpg
08/28/2020 16:30:21,2020-08-28 16:30:21Z,2020-08-28 04:30:21,https://pbs.twimg.com/media/EghWs2gU8AUCy7o.jpg,1299383829627461632,1299383821041725445,0,4871511149,MetTaskforce,https://twitter.com/MetTaskforce/status/1299383829627461632,A male attempted to run from #U42 officers in Bromley whilst in possession of this locking knife! On catching the male he has resisted officers and assaulted them! He was also found to be in possession of suspected stolen property! One arrest for multiple offences!!! 4333U https://t.co/EuImduCpuA,2020-08-28 04:30:21 MetTaskforce 1299383829627461632 0.jpg
08/25/2020 12:23:57,2020-08-25 12:23:57Z,2020-08-25 12:23:57,https://pbs.twimg.com/media/EgRBiXaWAAAKh29.jpg,1298234658208067585,1298234651245412352,0,4871511149,MetTaskforce,https://twitter.com/MetTaskforce/status/1298234658208067585,"#U425 plain clothes officers saw a male acting suspiciously on Bromley High Street! They soon found out why, following a #stopandsearch this nasty looking blade was found in his pocket! One male arrested for points and blades!!! https://t.co/5fvjMVqqEv",2020-08-25 12:23:57 MetTaskforce 1298234658208067585 0.jpg
08/24/2020 05:30:42,2020-08-24 05:30:42Z,2020-08-24 05:30:42,https://pbs.twimg.com/media/EgKZXFhWAAAv7uT.jpg,1297768274931965952,1297768264534196224,0,4871511149,MetTaskforce,https://twitter.com/MetTaskforce/status/1297768274931965952,As U4:3's working week draws to a close we finished as we started. It was the 2nd arrest of the week for a male who cant seem to leave the house without a knife in #Beckenham @MPSBromley along with arrests for drink drive &amp; drugs supply. #StopAndSearchWorks #RollOnRestDays ^4823U https://t.co/VYYFmO8fiH,2020-08-24 05:30:42 MetTaskforce 1297768274931965952 0.jpg
08/24/2020 05:30:42,2020-08-24 05:30:42Z,2020-08-24 05:30:42,https://pbs.twimg.com/media/EgKZXgWX0AAqghv.jpg,1297768274931965952,1297768271735934976,1,4871511149,MetTaskforce,https://twitter.com/MetTaskforce/status/1297768274931965952,As U4:3's working week draws to a close we finished as we started. It was the 2nd arrest of the week for a male who cant seem to leave the house without a knife in #Beckenham @MPSBromley along with arrests for drink drive &amp; drugs supply. #StopAndSearchWorks #RollOnRestDays ^4823U https://t.co/VYYFmO8fiH,2020-08-24 05:30:42 MetTaskforce 1297768274931965952 1.jpg
08/22/2020 07:28:11,2020-08-22 07:28:11Z,2020-08-22 07:28:11,https://pbs.twimg.com/media/EgAhCvnXoAEGSK5.jpg,1297073063310299136,1297073023707750401,0,4871511149,MetTaskforce,https://twitter.com/MetTaskforce/status/1297073063310299136,U4:3 took a tour of some of the more scenic parts of SE London tonight. We caught a male with a knife in #Bromley @MPSBromley 2 drug dealers with a check list &amp; a drug driver in #Orpington &amp; 3 wannabe F1 drivers who failed to stop in #AbbeyWood @MPSBexley #SightSeeing ^4823U https://t.co/EGPoYii3JX,2020-08-22 07:28:11 MetTaskforce 1297073063310299136 0.jpg
08/22/2020 07:28:11,2020-08-22 07:28:11Z,2020-08-22 07:28:11,https://pbs.twimg.com/media/EgAhDldXgAEifop.jpg,1297073063310299136,1297073038161313793,1,4871511149,MetTaskforce,https://twitter.com/MetTaskforce/status/1297073063310299136,U4:3 took a tour of some of the more scenic parts of SE London tonight. We caught a male with a knife in #Bromley @MPSBromley 2 drug dealers with a check list &amp; a drug driver in #Orpington &amp; 3 wannabe F1 drivers who failed to stop in #AbbeyWood @MPSBexley #SightSeeing ^4823U https://t.co/EGPoYii3JX,2020-08-22 07:28:11 MetTaskforce 1297073063310299136 1.jpg
08/22/2020 07:28:11,2020-08-22 07:28:11Z,2020-08-22 07:28:11,https://pbs.twimg.com/media/EgAhERFXgAEMX5t.jpg,1297073063310299136,1297073049871810561,2,4871511149,MetTaskforce,https://twitter.com/MetTaskforce/status/1297073063310299136,U4:3 took a tour of some of the more scenic parts of SE London tonight. We caught a male with a knife in #Bromley @MPSBromley 2 drug dealers with a check list &amp; a drug driver in #Orpington &amp; 3 wannabe F1 drivers who failed to stop in #AbbeyWood @MPSBexley #SightSeeing ^4823U https://t.co/EGPoYii3JX,2020-08-22 07:28:11 MetTaskforce 1297073063310299136 2.jpg
08/21/2020 20:58:55,2020-08-21 20:58:55Z,2020-08-21 08:58:55,https://pbs.twimg.com/media/Ef-RCqIWoAc5Czb.jpg,1296914704162594817,1296914692561084423,0,4871511149,MetTaskforce,https://twitter.com/MetTaskforce/status/1296914704162594817,"U3:3 officers assisting @MPSWForest in the E4 area, officers tracked down a male believed armed with a weapon. On conducting a stop search, this made offensive weapon was found. Stop search works. Another weapon off the streets! ^3510U #stopandsearch #saferlondon #TSG https://t.co/laOWZlqt5k",2020-08-21 08:58:55 MetTaskforce 1296914704162594817 0.jpg
08/21/2020 17:33:20,2020-08-21 17:33:20Z,2020-08-21 05:33:20,https://pbs.twimg.com/media/Ef9h_j6WsAAyUPo.jpg,1296862966894264322,1296862962305642496,0,4871511149,MetTaskforce,https://twitter.com/MetTaskforce/status/1296862966894264322,Officers from U3:3 stopped a male believed shoplifting from Tesco in @MPSBarkDag. Stop search revealed he was in possession of this knife and an item for going equipped to steal. Stop search taking weapons off the streets of London ^3510U #Stopsearch #TSG https://t.co/Zjz3xb8vMm,2020-08-21 05:33:20 MetTaskforce 1296862966894264322 0.jpg
08/21/2020 07:10:30,2020-08-21 07:10:30Z,2020-08-21 07:10:30,https://pbs.twimg.com/media/Ef7Tb0SX0AEnZU9.jpg,1296706225841807360,1296706217574912001,0,4871511149,MetTaskforce,https://twitter.com/MetTaskforce/status/1296706225841807360,"U4:3 dont like to disappoint so last night gave some of our biggest fans the VIP treatment. After a car chase in @MPSLewisham we recovered a stolen Range Rover &amp; arrested the occupants, found a wanted male &amp; met a fledgling drug dealer in @MPSBexley #SuperFans #ClippedHisWings https://t.co/7oEupOprQK",2020-08-21 07:10:30 MetTaskforce 1296706225841807360 0.jpg
08/21/2020 07:10:30,2020-08-21 07:10:30Z,2020-08-21 07:10:30,https://pbs.twimg.com/media/Ef7Tb-hWkAEJHxe.jpg,1296706225841807360,1296706220322099201,1,4871511149,MetTaskforce,https://twitter.com/MetTaskforce/status/1296706225841807360,"U4:3 dont like to disappoint so last night gave some of our biggest fans the VIP treatment. After a car chase in @MPSLewisham we recovered a stolen Range Rover &amp; arrested the occupants, found a wanted male &amp; met a fledgling drug dealer in @MPSBexley #SuperFans #ClippedHisWings https://t.co/7oEupOprQK",2020-08-21 07:10:30 MetTaskforce 1296706225841807360 1.jpg
08/21/2020 07:10:30,2020-08-21 07:10:30Z,2020-08-21 07:10:30,https://pbs.twimg.com/media/Ef7TcJuWAAIST_c.jpg,1296706225841807360,1296706223329378306,2,4871511149,MetTaskforce,https://twitter.com/MetTaskforce/status/1296706225841807360,"U4:3 dont like to disappoint so last night gave some of our biggest fans the VIP treatment. After a car chase in @MPSLewisham we recovered a stolen Range Rover &amp; arrested the occupants, found a wanted male &amp; met a fledgling drug dealer in @MPSBexley #SuperFans #ClippedHisWings https://t.co/7oEupOprQK",2020-08-21 07:10:30 MetTaskforce 1296706225841807360 2.jpg
08/20/2020 04:22:49,2020-08-20 04:22:49Z,2020-08-20 04:22:49,https://pbs.twimg.com/media/Ef1jWgUWsAUEhxc.jpg,1296301638886600704,1296301506036150277,0,4871511149,MetTaskforce,https://twitter.com/MetTaskforce/status/1296301638886600704,"Tackling the organised gangs on #LondonRoad in @MPSCroydon tonight, eagle eyed U4:3 officers spotted a male wanted for drugs supply offences. After some detective work his nearby stash house was found complete with 4 accomplices &amp; a kitchen full of goodies #SuperSleuthing ^4823U https://t.co/fyCqD6nB4w",2020-08-20 04:22:49 MetTaskforce 1296301638886600704 0.jpg
08/20/2020 04:22:49,2020-08-20 04:22:49Z,2020-08-20 04:22:49,https://pbs.twimg.com/media/Ef1jZMNXkAATw0u.jpg,1296301638886600704,1296301552177745920,1,4871511149,MetTaskforce,https://twitter.com/MetTaskforce/status/1296301638886600704,"Tackling the organised gangs on #LondonRoad in @MPSCroydon tonight, eagle eyed U4:3 officers spotted a male wanted for drugs supply offences. After some detective work his nearby stash house was found complete with 4 accomplices &amp; a kitchen full of goodies #SuperSleuthing ^4823U https://t.co/fyCqD6nB4w",2020-08-20 04:22:49 MetTaskforce 1296301638886600704 1.jpg
08/20/2020 04:22:49,2020-08-20 04:22:49Z,2020-08-20 04:22:49,https://pbs.twimg.com/media/Ef1jeBFXYAU_DFT.jpg,1296301638886600704,1296301635090735109,2,4871511149,MetTaskforce,https://twitter.com/MetTaskforce/status/1296301638886600704,"Tackling the organised gangs on #LondonRoad in @MPSCroydon tonight, eagle eyed U4:3 officers spotted a male wanted for drugs supply offences. After some detective work his nearby stash house was found complete with 4 accomplices &amp; a kitchen full of goodies #SuperSleuthing ^4823U https://t.co/fyCqD6nB4w",2020-08-20 04:22:49 MetTaskforce 1296301638886600704 2.jpg
08/20/2020 03:46:59,2020-08-20 03:46:59Z,2020-08-20 03:46:59,https://pbs.twimg.com/media/Ef1bRPCXoAEtUe_.jpg,1296292621682343936,1296292619404943361,0,4871511149,MetTaskforce,https://twitter.com/MetTaskforce/status/1296292621682343936,"U4:3 have continued their hard work across South East London tonight, disrupting the activities of those intent on committing violent crime. Proactive #StopAndSearch of 2 men in #Beckenham while working on @MPSBromley uncovered this assortment of weapons #ToolsOfTheTrade ^4823U https://t.co/ebWkmiZAXw",2020-08-20 03:46:59 MetTaskforce 1296292621682343936 0.jpg
08/19/2020 13:54:48,2020-08-19 13:54:48Z,2020-08-19 01:54:48,https://pbs.twimg.com/media/EfycQJxXoAIBQBi.jpg,1296083193318252546,1296082594090688514,0,4871511149,MetTaskforce,https://twitter.com/MetTaskforce/status/1296083193318252546,"3 suspects commit a Carjacking armed with knives. Dog Unit attends location &amp; spots 3 suspects who decamp and hide. PD Freya &amp; PD Jazz deployed. 1 person found in possession of 2 knives, other 2 found hiding in bushes. All 3 arrested for robbery. ^4347U https://t.co/hsl6GskKCc",2020-08-19 01:54:48 MetTaskforce 1296083193318252546 0.jpg
08/19/2020 13:54:48,2020-08-19 13:54:48Z,2020-08-19 01:54:48,https://pbs.twimg.com/media/EfycnbIXsAEdYzS.jpg,1296083193318252546,1296082993887555585,1,4871511149,MetTaskforce,https://twitter.com/MetTaskforce/status/1296083193318252546,"3 suspects commit a Carjacking armed with knives. Dog Unit attends location &amp; spots 3 suspects who decamp and hide. PD Freya &amp; PD Jazz deployed. 1 person found in possession of 2 knives, other 2 found hiding in bushes. All 3 arrested for robbery. ^4347U https://t.co/hsl6GskKCc",2020-08-19 01:54:48 MetTaskforce 1296083193318252546 1.jpg
08/19/2020 13:54:48,2020-08-19 13:54:48Z,2020-08-19 01:54:48,https://pbs.twimg.com/media/EfyceaRWAAAQg3I.jpg,1296083193318252546,1296082839037935616,2,4871511149,MetTaskforce,https://twitter.com/MetTaskforce/status/1296083193318252546,"3 suspects commit a Carjacking armed with knives. Dog Unit attends location &amp; spots 3 suspects who decamp and hide. PD Freya &amp; PD Jazz deployed. 1 person found in possession of 2 knives, other 2 found hiding in bushes. All 3 arrested for robbery. ^4347U https://t.co/hsl6GskKCc",2020-08-19 01:54:48 MetTaskforce 1296083193318252546 2.jpg
08/15/2020 18:32:04,2020-08-15 18:32:04Z,2020-08-15 06:32:04,https://pbs.twimg.com/media/Efe11I7WsAUoPK0.jpg,1294703421195509761,1294703342426435589,0,4871511149,MetTaskforce,https://twitter.com/MetTaskforce/status/1294703421195509761,"This weekend U4:3 were #Trainspotting at East &amp; West Croydon Stations with @BTPLondon &amp; our superb DSU colleagues with PD's Jensen&amp;Rammer.Targeting #CountyLines drug dealing, 6 arrests were made for Drugs supply, weapon offences &amp; assault police.#StopAndSearch #PawPatrol ^4823U https://t.co/7iCZXblbJM",2020-08-15 06:32:04 MetTaskforce 1294703421195509761 0.jpg
08/15/2020 18:32:04,2020-08-15 18:32:04Z,2020-08-15 06:32:04,https://pbs.twimg.com/media/Efe119_WAAAPEdT.jpg,1294703421195509761,1294703356670246912,1,4871511149,MetTaskforce,https://twitter.com/MetTaskforce/status/1294703421195509761,"This weekend U4:3 were #Trainspotting at East &amp; West Croydon Stations with @BTPLondon &amp; our superb DSU colleagues with PD's Jensen&amp;Rammer.Targeting #CountyLines drug dealing, 6 arrests were made for Drugs supply, weapon offences &amp; assault police.#StopAndSearch #PawPatrol ^4823U https://t.co/7iCZXblbJM",2020-08-15 06:32:04 MetTaskforce 1294703421195509761 1.jpg
08/15/2020 18:32:04,2020-08-15 18:32:04Z,2020-08-15 06:32:04,https://pbs.twimg.com/media/Efe12kdWAAYXELA.jpg,1294703421195509761,1294703366996623366,2,4871511149,MetTaskforce,https://twitter.com/MetTaskforce/status/1294703421195509761,"This weekend U4:3 were #Trainspotting at East &amp; West Croydon Stations with @BTPLondon &amp; our superb DSU colleagues with PD's Jensen&amp;Rammer.Targeting #CountyLines drug dealing, 6 arrests were made for Drugs supply, weapon offences &amp; assault police.#StopAndSearch #PawPatrol ^4823U https://t.co/7iCZXblbJM",2020-08-15 06:32:04 MetTaskforce 1294703421195509761 2.jpg
08/15/2020 18:32:04,2020-08-15 18:32:04Z,2020-08-15 06:32:04,https://pbs.twimg.com/media/Efe13fEXsAA22NV.jpg,1294703421195509761,1294703382729568256,3,4871511149,MetTaskforce,https://twitter.com/MetTaskforce/status/1294703421195509761,"This weekend U4:3 were #Trainspotting at East &amp; West Croydon Stations with @BTPLondon &amp; our superb DSU colleagues with PD's Jensen&amp;Rammer.Targeting #CountyLines drug dealing, 6 arrests were made for Drugs supply, weapon offences &amp; assault police.#StopAndSearch #PawPatrol ^4823U https://t.co/7iCZXblbJM",2020-08-15 06:32:04 MetTaskforce 1294703421195509761 3.jpg
08/13/2020 15:48:07,2020-08-13 15:48:07Z,2020-08-13 03:48:07,https://pbs.twimg.com/media/EfT9MatXsAInLuC.jpg,1293937386922086400,1293937382732050434,0,4871511149,MetTaskforce,https://twitter.com/MetTaskforce/status/1293937386922086400,#TSG NE working with our friends and colleagues from @BTPStratford @BTPLondon. We spotted two suspicious juveniles in #Stratford #E15. A #stopandsearch later and it’s one arrest for possession of this #knife ^3021 https://t.co/wgoBElDH5d,2020-08-13 03:48:07 MetTaskforce 1293937386922086400 0.jpg
08/11/2020 23:10:02,2020-08-11 23:10:02Z,2020-08-11 11:10:02,https://pbs.twimg.com/media/EfLPKKmWAAkd6vO.jpg,1293323820552658945,1293323816559575049,0,4871511149,MetTaskforce,https://twitter.com/MetTaskforce/status/1293323820552658945,"U3:2 &amp; U3:5 Tonight Concluded a 2 day pro-active operation with @MPSRTPC #raptor units on @MPSNewham. 
Over 10 arrests for offences including drug driving, burglary &amp; tonight’s last stop 4 males searched &amp; arrested for possession of these nasty weapons #stopandsearch #knifecrime https://t.co/mRiz9fiyrj",2020-08-11 11:10:02 MetTaskforce 1293323820552658945 0.jpg
08/11/2020 23:10:02,2020-08-11 23:10:02Z,2020-08-11 11:10:02,https://pbs.twimg.com/media/EfLPKKlXgAEfo4T.jpg,1293323820552658945,1293323816555479041,1,4871511149,MetTaskforce,https://twitter.com/MetTaskforce/status/1293323820552658945,"U3:2 &amp; U3:5 Tonight Concluded a 2 day pro-active operation with @MPSRTPC #raptor units on @MPSNewham. 
Over 10 arrests for offences including drug driving, burglary &amp; tonight’s last stop 4 males searched &amp; arrested for possession of these nasty weapons #stopandsearch #knifecrime https://t.co/mRiz9fiyrj",2020-08-11 11:10:02 MetTaskforce 1293323820552658945 1.jpg
08/10/2020 20:39:28,2020-08-10 20:39:28Z,2020-08-10 08:39:28,https://pbs.twimg.com/media/EfFjGdjXsAA0eXO.jpg,1292923542707855366,1292923530695389184,0,4871511149,MetTaskforce,https://twitter.com/MetTaskforce/status/1292923542707855366,"TSG U44 strike again! Officers had a short foot chase after a wanted male tried to make off from them but wasn’t quick enough 💪🏼 He was also in possession of two prohibited weapons which will now be tested &amp; are off the street. ^4717U
#NotQuickEnough https://t.co/bngwpBEjVp",2020-08-10 08:39:28 MetTaskforce 1292923542707855366 0.jpg
08/10/2020 18:59:07,2020-08-10 18:59:07Z,2020-08-10 06:59:07,https://pbs.twimg.com/media/EfFMIfqXsAAp4Ms.jpg,1292898286903480321,1292898276853919744,0,4871511149,MetTaskforce,https://twitter.com/MetTaskforce/status/1292898286903480321,TSG U44 officers conducting proactive patrols in #Croydon. They stop and searched a Male who they found to be in possession of a taser disguised as a phone! One nasty weapon off the street &amp; one in custody! @MPSCroydon #StopAndSearchWorks ^4717U https://t.co/npVggq4Zf8,2020-08-10 06:59:07 MetTaskforce 1292898286903480321 0.jpg
08/10/2020 18:59:07,2020-08-10 18:59:07Z,2020-08-10 06:59:07,https://pbs.twimg.com/media/EfFMIfnWsAAIJcp.jpg,1292898286903480321,1292898276841271296,1,4871511149,MetTaskforce,https://twitter.com/MetTaskforce/status/1292898286903480321,TSG U44 officers conducting proactive patrols in #Croydon. They stop and searched a Male who they found to be in possession of a taser disguised as a phone! One nasty weapon off the street &amp; one in custody! @MPSCroydon #StopAndSearchWorks ^4717U https://t.co/npVggq4Zf8,2020-08-10 06:59:07 MetTaskforce 1292898286903480321 1.jpg
08/09/2020 15:51:58,2020-08-09 15:51:58Z,2020-08-09 03:51:58,https://pbs.twimg.com/media/Ee_Xt0OWsAEZJTu.jpg,1292488804201267201,1292488800191557633,0,4871511149,MetTaskforce,https://twitter.com/MetTaskforce/status/1292488804201267201,"#TSG #U31 another #stopandsearch another #knife another juvenile arrested, this time in #Leytonstone #E11 @MPSWForest ^3021 https://t.co/xPQGgptgkK",2020-08-09 03:51:58 MetTaskforce 1292488804201267201 0.jpg
08/09/2020 03:57:15,2020-08-09 03:57:15Z,2020-08-09 03:57:15,https://pbs.twimg.com/media/Ee80H0IXYAAuNEQ.jpg,1292308937023401986,1292308926936080384,0,4871511149,MetTaskforce,https://twitter.com/MetTaskforce/status/1292308937023401986,"U5:1 carrying out proactive patrols on @MPSWestminster . Following a stop and search of a female, this nasty lock knife was found in her possession. Female arrested and on her way to custody. https://t.co/2hLSXS63cq",2020-08-09 03:57:15 MetTaskforce 1292308937023401986 0.jpg
08/07/2020 13:15:50,2020-08-07 13:15:50Z,2020-08-07 01:15:50,https://pbs.twimg.com/media/Ee0gzGNWkAEyx1C.jpg,1291724734590222336,1291724730337234945,0,4871511149,MetTaskforce,https://twitter.com/MetTaskforce/status/1291724734590222336,"#TSG #U32 #stopandsearch #teamwork @newham One Male arrested for possession of this knife following a intelligence led Stop &amp; Search.
Great example of local community working together with Police for positive outcomes ^3267U https://t.co/2ZcumdsFK0",2020-08-07 01:15:50 MetTaskforce 1291724734590222336 0.jpg
08/07/2020 13:07:13,2020-08-07 13:07:13Z,2020-08-07 01:07:13,https://pbs.twimg.com/media/Ee0e01vX0AEzebq.jpg,1291722567296966656,1291722561253003265,0,4871511149,MetTaskforce,https://twitter.com/MetTaskforce/status/1291722567296966656,#TSG #U31 first #stopandsearch of the day in @MPSNewham @MPSLittlellford one juvenile male arrested for possession of this #knife. Great support from the local community when they saw what we’d found ^3021 https://t.co/vZjfgeKIsf,2020-08-07 01:07:13 MetTaskforce 1291722567296966656 0.jpg
08/07/2020 11:48:32,2020-08-07 11:48:32Z,2020-08-07 11:48:32,https://pbs.twimg.com/media/Ee0M0MkWkAIT-Qd.jpg,1291702763399913472,1291702758991630338,0,4871511149,MetTaskforce,https://twitter.com/MetTaskforce/status/1291702763399913472,TSG U413 spotted three males in @MPSCroydon town centre yesterday after seeing one discard something in the bin upon seeing us. Two were detained with one getting away after a foot case. Found in the bin was this knife. 1/2 https://t.co/uLjB4yiqvu,2020-08-07 11:48:32 MetTaskforce 1291702763399913472 0.jpg
08/05/2020 23:37:41,2020-08-05 23:37:41Z,2020-08-05 11:37:41,https://pbs.twimg.com/media/Eesb8uOXYAIqKhL.jpg,1291156454192414725,1291156448186163202,0,4871511149,MetTaskforce,https://twitter.com/MetTaskforce/status/1291156454192414725,"TSG U5.1 currently on Commissioners Reserve in @MPSKenChel. Male arrested after being searched following a vehicle stop, found in possession of a knife, cannabis and also failing a road side fitness test in regards to drugs. https://t.co/IdSAgICsUg",2020-08-05 11:37:41 MetTaskforce 1291156454192414725 0.jpg
08/04/2020 12:46:33,2020-08-04 12:46:33Z,2020-08-04 12:46:33,https://pbs.twimg.com/media/Eek9KIFXkAEfVOP.jpg,1290630201496481792,1290630012396343297,0,4871511149,MetTaskforce,https://twitter.com/MetTaskforce/status/1290630201496481792,"#TSG Yesterday, two males were arrested by officers from U54 on @MPSWestminster for possession of an offensive weapon and affray, after it was reported threats of violence were made to members of the public. A search revealed the below knife, which was seized. ^5680U https://t.co/DspD1PVeyT",2020-08-04 12:46:33 MetTaskforce 1290630201496481792 0.jpg
08/01/2020 17:10:43,2020-08-01 17:10:43Z,2020-08-01 05:10:43,https://pbs.twimg.com/media/EeWdBPWXgAAoa36.jpg,1289609516976308224,1289609512937291776,0,4871511149,MetTaskforce,https://twitter.com/MetTaskforce/status/1289609516976308224,"Officers of U4.2 starting their shift today with a violent male arrested for a knife. As officers approached this male he tried to run from and punched officers, found to be in possession of a knife! One arrest for assault Police and this horrible blade #MPSLewisham https://t.co/tJhP9U5X9r",2020-08-01 05:10:43 MetTaskforce 1289609516976308224 0.jpg
08/01/2020 12:59:38,2020-08-01 12:59:38Z,2020-08-01 12:59:38,https://pbs.twimg.com/media/EeVjjS8WoAEcIsB.jpg,1289546331921367040,1289546326343065601,0,4871511149,MetTaskforce,https://twitter.com/MetTaskforce/status/1289546331921367040,.@MetTaskforce  #TSG #U23. Whilst in @MPSBrent today we spoke to a member of the public. He stated that youths use the area for possible drug supply &amp; conceal items nearby. A  search of the area found a nasty looking knife. If you have concerns then always call the Police. 2646U https://t.co/mQhbI0kL0k,2020-08-01 12:59:38 MetTaskforce 1289546331921367040 0.jpg
08/01/2020 08:04:54,2020-08-01 08:04:54Z,2020-08-01 08:04:54,https://pbs.twimg.com/media/EeUgGBjWoAIXz-L.jpg,1289472160596029441,1289472156179537922,0,4871511149,MetTaskforce,https://twitter.com/MetTaskforce/status/1289472160596029441,"TSG #U52 have just finished another night shift patrolling @MPSWestminster. We arrested a male near Harrow Road W9. He was stopped, searched and found in possession of this knife. ^5213U https://t.co/vcQEbyqp4c",2020-08-01 08:04:54 MetTaskforce 1289472160596029441 0.jpg
07/28/2020 18:31:19,2020-07-28 18:31:19Z,2020-07-28 06:31:19,https://pbs.twimg.com/media/EeCJFLXWoAknaPZ.jpg,1288180248769699843,1288180215471054857,0,4871511149,MetTaskforce,https://twitter.com/MetTaskforce/status/1288180248769699843,"TSG U3:2 and TSG Pro-Active unit executed drugs warrant today alongside Whalebone Ward SNT. Over 200 plants seized street value of £100,000 as well as Class A drugs and Made offensive weapons. Linked to organised gangs. ^3558U https://t.co/OjtXvx1WHy",2020-07-28 06:31:19 MetTaskforce 1288180248769699843 0.jpg
07/28/2020 18:31:19,2020-07-28 18:31:19Z,2020-07-28 06:31:19,https://pbs.twimg.com/media/EeCJFLUWsAMqKL3.jpg,1288180248769699843,1288180215458476035,1,4871511149,MetTaskforce,https://twitter.com/MetTaskforce/status/1288180248769699843,"TSG U3:2 and TSG Pro-Active unit executed drugs warrant today alongside Whalebone Ward SNT. Over 200 plants seized street value of £100,000 as well as Class A drugs and Made offensive weapons. Linked to organised gangs. ^3558U https://t.co/OjtXvx1WHy",2020-07-28 06:31:19 MetTaskforce 1288180248769699843 1.jpg
07/28/2020 18:31:19,2020-07-28 18:31:19Z,2020-07-28 06:31:19,https://pbs.twimg.com/media/EeCJFLSXYAYOCFa.jpg,1288180248769699843,1288180215450132486,2,4871511149,MetTaskforce,https://twitter.com/MetTaskforce/status/1288180248769699843,"TSG U3:2 and TSG Pro-Active unit executed drugs warrant today alongside Whalebone Ward SNT. Over 200 plants seized street value of £100,000 as well as Class A drugs and Made offensive weapons. Linked to organised gangs. ^3558U https://t.co/OjtXvx1WHy",2020-07-28 06:31:19 MetTaskforce 1288180248769699843 2.jpg
07/28/2020 18:31:19,2020-07-28 18:31:19Z,2020-07-28 06:31:19,https://pbs.twimg.com/media/EeCJFLYXsAMIdF2.jpg,1288180248769699843,1288180215475318787,3,4871511149,MetTaskforce,https://twitter.com/MetTaskforce/status/1288180248769699843,"TSG U3:2 and TSG Pro-Active unit executed drugs warrant today alongside Whalebone Ward SNT. Over 200 plants seized street value of £100,000 as well as Class A drugs and Made offensive weapons. Linked to organised gangs. ^3558U https://t.co/OjtXvx1WHy",2020-07-28 06:31:19 MetTaskforce 1288180248769699843 3.jpg
07/24/2020 21:12:38,2020-07-24 21:12:38Z,2020-07-24 09:12:38,https://pbs.twimg.com/media/EduHqvpXYAE9GMK.jpg,1286771293354950656,1286771286958628865,0,4871511149,MetTaskforce,https://twitter.com/MetTaskforce/status/1286771293354950656,"Male with links to gangs stopped by TSG U53 on @MPSKenChel. Detained for a search. Knife found hidden in waistband. Struggled with officers, arrested for Possession of Offensive Weapon and Obstruct Police. Cannabis found secreted in his pants. Further arrested ^ 5268U https://t.co/nsfrTemCTS",2020-07-24 09:12:38 MetTaskforce 1286771293354950656 0.jpg
07/23/2020 15:32:44,2020-07-23 15:32:44Z,2020-07-23 03:32:44,https://pbs.twimg.com/media/EdnwRyvWkAEvtQk.jpg,1286323367663087621,1286323357059813377,0,4871511149,MetTaskforce,https://twitter.com/MetTaskforce/status/1286323367663087621,TSG U22 conducted 2 early morning Rapid Entries at properties in @MPSHackney this morning which resulted in 2 males arrested for being involved in several shootings within London! Correct tactics used which meant the suspect didnt have time to grab these bedroom toys! #KnivesKill https://t.co/RihgS3jqKF,2020-07-23 03:32:44 MetTaskforce 1286323367663087621 0.jpg
07/23/2020 15:32:44,2020-07-23 15:32:44Z,2020-07-23 03:32:44,https://pbs.twimg.com/media/EdnwSLkX0AEqECG.jpg,1286323367663087621,1286323363724644353,1,4871511149,MetTaskforce,https://twitter.com/MetTaskforce/status/1286323367663087621,TSG U22 conducted 2 early morning Rapid Entries at properties in @MPSHackney this morning which resulted in 2 males arrested for being involved in several shootings within London! Correct tactics used which meant the suspect didnt have time to grab these bedroom toys! #KnivesKill https://t.co/RihgS3jqKF,2020-07-23 03:32:44 MetTaskforce 1286323367663087621 1.jpg
07/21/2020 18:18:50,2020-07-21 18:18:50Z,2020-07-21 06:18:50,https://pbs.twimg.com/media/EdeDHROXkAErszl.jpg,1285640395360276490,1285640379543556097,0,4871511149,MetTaskforce,https://twitter.com/MetTaskforce/status/1285640395360276490,"TSG U53, patrols on @MPSKenChel. Vehicle stop. Detained for drugs search. Male driver found with cannabis and this knife in the glove compartment. No reasonable excuse. Arrested. #StopAndSearch https://t.co/1XW9NOXWwl",2020-07-21 06:18:50 MetTaskforce 1285640395360276490 0.jpg
07/18/2020 22:14:13,2020-07-18 22:14:13Z,2020-07-18 10:14:13,https://pbs.twimg.com/media/EdPcOkiWAAA9mt6.jpg,1284612466257928192,1284612461614727168,0,4871511149,MetTaskforce,https://twitter.com/MetTaskforce/status/1284612466257928192,"PD Rose started the night shift off getting another knife off the street. This time in @MPSSouthwark when she found a Rambo knife discarded under a bush after local officers had a foot chase.  
^6329CO
#policedog #dogsnose https://t.co/YI81YGmele",2020-07-18 10:14:13 MetTaskforce 1284612466257928192 0.jpg
07/18/2020 14:19:42,2020-07-18 14:19:42Z,2020-07-18 02:19:42,https://pbs.twimg.com/media/EdNvkReX0AIPaUq.jpg,1284493049427632130,1284492987687489538,0,4871511149,MetTaskforce,https://twitter.com/MetTaskforce/status/1284493049427632130,TSG U5.1 are currently working early turn Commissioners Reserve this weekend. Stop and searches so far have resulted in arrests for offensive weapons on @MPSWestminster and @MPSLewisham https://t.co/5tvlIMGksh,2020-07-18 02:19:42 MetTaskforce 1284493049427632130 0.jpg
07/18/2020 14:19:42,2020-07-18 14:19:42Z,2020-07-18 02:19:42,https://pbs.twimg.com/media/EdNvkRiXoAAo14E.jpg,1284493049427632130,1284492987704254464,1,4871511149,MetTaskforce,https://twitter.com/MetTaskforce/status/1284493049427632130,TSG U5.1 are currently working early turn Commissioners Reserve this weekend. Stop and searches so far have resulted in arrests for offensive weapons on @MPSWestminster and @MPSLewisham https://t.co/5tvlIMGksh,2020-07-18 02:19:42 MetTaskforce 1284493049427632130 1.jpg
07/17/2020 02:35:52,2020-07-17 02:35:52Z,2020-07-17 02:35:52,https://pbs.twimg.com/media/EdGE7u2X0AAZ5EO.jpg,1283953535273574402,1283953530500534272,0,4871511149,MetTaskforce,https://twitter.com/MetTaskforce/status/1283953535273574402,"U24 patrolling @MPSHarrow conduct a road traffic stop which leads to a search. This “knife” along with a stab vest and balaclava recovered 
#StopAndSearch #KnivesDestroyLives #TSG
^2842U https://t.co/MGcD5QZCM3",2020-07-17 02:35:52 MetTaskforce 1283953535273574402 0.jpg
07/12/2020 04:46:34,2020-07-12 04:46:34Z,2020-07-12 04:46:34,https://pbs.twimg.com/media/Ecsy5dgXkAA-jxo.jpg,1282174487102980097,1282174481671360512,0,4871511149,MetTaskforce,https://twitter.com/MetTaskforce/status/1282174487102980097,Another knife and some more proceeds of drug dealing removed from the street after an arrest following a stop and search on @MPSWandsworth by TSG U5.1 https://t.co/0gAX7kEJ3f,2020-07-12 04:46:34 MetTaskforce 1282174487102980097 0.jpg
07/11/2020 10:40:06,2020-07-11 10:40:06Z,2020-07-11 10:40:06,https://pbs.twimg.com/media/Eco6M-DXYAM9Ix6.jpg,1281901070126587909,1281901038430281731,0,4871511149,MetTaskforce,https://twitter.com/MetTaskforce/status/1281901070126587909,TSG 2:2 patrolling Finchley today &amp; saw two males immediately change their behaviour upon seeing us. Proactive stop &amp; search conducted &amp; this dangerous weapon found in the 16 year olds pocket! Other boy found with drugs - 2 Arrested! #Stop&amp;SearchWorks @roysmithpolice @MPSBarnet https://t.co/HgAQ8mR5s2,2020-07-11 10:40:06 MetTaskforce 1281901070126587909 0.jpg
07/11/2020 10:40:06,2020-07-11 10:40:06Z,2020-07-11 10:40:06,https://pbs.twimg.com/media/Eco6N97X0AA2V_u.jpg,1281901070126587909,1281901055576625152,1,4871511149,MetTaskforce,https://twitter.com/MetTaskforce/status/1281901070126587909,TSG 2:2 patrolling Finchley today &amp; saw two males immediately change their behaviour upon seeing us. Proactive stop &amp; search conducted &amp; this dangerous weapon found in the 16 year olds pocket! Other boy found with drugs - 2 Arrested! #Stop&amp;SearchWorks @roysmithpolice @MPSBarnet https://t.co/HgAQ8mR5s2,2020-07-11 10:40:06 MetTaskforce 1281901070126587909 1.jpg
07/09/2020 08:17:42,2020-07-09 08:17:42Z,2020-07-09 08:17:42,https://pbs.twimg.com/media/EceA3T2WsAEvfxb.jpg,1281140459579080705,1281134306719608833,0,4871511149,MetTaskforce,https://twitter.com/MetTaskforce/status/1281140459579080705,"**Update** 80 rocks of crack cocaine were found in the suspects pants after arrest. The suspect has since been charged and remanded for possession with intent to supply Class A, possession of an offensive weapon and possession of cannabis. #StopAndSearch #thursdaymorning ^4347U https://t.co/Fi78TAu1x9",2020-07-09 08:17:42 MetTaskforce 1281140459579080705 0.jpg
07/07/2020 20:47:59,2020-07-07 20:47:59Z,2020-07-07 08:47:59,https://pbs.twimg.com/media/EcWe_asWsAMYjr7.jpg,1280604499296518145,1280604481391079427,0,4871511149,MetTaskforce,https://twitter.com/MetTaskforce/status/1280604499296518145,"PD Rose was busy again today getting another knife off the street after a male ran off from TSG and discarded something in @MPSCroydon. Knife found by Rose on the route and one arrested!
#policedog #dogsnose https://t.co/Qpi6N5zChU",2020-07-07 08:47:59 MetTaskforce 1280604499296518145 0.jpg
07/07/2020 20:47:59,2020-07-07 20:47:59Z,2020-07-07 08:47:59,https://pbs.twimg.com/media/EcWe_auXYAAp2L6.jpg,1280604499296518145,1280604481399513088,1,4871511149,MetTaskforce,https://twitter.com/MetTaskforce/status/1280604499296518145,"PD Rose was busy again today getting another knife off the street after a male ran off from TSG and discarded something in @MPSCroydon. Knife found by Rose on the route and one arrested!
#policedog #dogsnose https://t.co/Qpi6N5zChU",2020-07-07 08:47:59 MetTaskforce 1280604499296518145 1.jpg
07/07/2020 16:10:10,2020-07-07 16:10:10Z,2020-07-07 04:10:10,https://pbs.twimg.com/media/EcVfYFWWoAAYSYg.jpg,1280534583319179268,1280534536414208000,0,4871511149,MetTaskforce,https://twitter.com/MetTaskforce/status/1280534583319179268,#TSG #U31 on patrol in @MPSLittlellford #Newham #E12.  #stopandsearch one baddie arrested for possession of this lock #knife ^3021 @MPSNewham https://t.co/X3lZD8EMgc,2020-07-07 04:10:10 MetTaskforce 1280534583319179268 0.jpg
07/07/2020 08:58:11,2020-07-07 08:58:11Z,2020-07-07 08:58:11,https://pbs.twimg.com/media/EcT8ilUWsAErSQv.jpg,1280425871342473216,1280425865143300097,0,4871511149,MetTaskforce,https://twitter.com/MetTaskforce/status/1280425871342473216,"Busy evening yesterday for PD Rose after a disturbance between a group of youths on @MPSLewisham. A search found this knife discarded in the street and some cannabis. 
#policedogs https://t.co/Lo7XvwrY5G",2020-07-07 08:58:11 MetTaskforce 1280425871342473216 0.jpg
07/07/2020 08:58:11,2020-07-07 08:58:11Z,2020-07-07 08:58:11,https://pbs.twimg.com/media/EcT8ilbWsAAkVi5.jpg,1280425871342473216,1280425865172660224,1,4871511149,MetTaskforce,https://twitter.com/MetTaskforce/status/1280425871342473216,"Busy evening yesterday for PD Rose after a disturbance between a group of youths on @MPSLewisham. A search found this knife discarded in the street and some cannabis. 
#policedogs https://t.co/Lo7XvwrY5G",2020-07-07 08:58:11 MetTaskforce 1280425871342473216 1.jpg
06/30/2020 07:47:12,2020-06-30 07:47:12Z,2020-06-30 07:47:12,https://pbs.twimg.com/media/EbvpKW_XQAIBH06.jpg,1277871292193087491,1277871283468976130,0,4871511149,MetTaskforce,https://twitter.com/MetTaskforce/status/1277871292193087491,#TSG3 intercept weapons heading for street gangs this morning with intel led arrests . Knives and a taser torch purchased on line by persons with known gang affiliations on @MPSRedbridge . 3237U https://t.co/cdtWDpYuhG,2020-06-30 07:47:12 MetTaskforce 1277871292193087491 0.jpg
06/30/2020 07:47:12,2020-06-30 07:47:12Z,2020-06-30 07:47:12,https://pbs.twimg.com/media/EbvpKXGWAAAWwKM.jpg,1277871292193087491,1277871283498254336,1,4871511149,MetTaskforce,https://twitter.com/MetTaskforce/status/1277871292193087491,#TSG3 intercept weapons heading for street gangs this morning with intel led arrests . Knives and a taser torch purchased on line by persons with known gang affiliations on @MPSRedbridge . 3237U https://t.co/cdtWDpYuhG,2020-06-30 07:47:12 MetTaskforce 1277871292193087491 1.jpg
06/30/2020 02:52:54,2020-06-30 02:52:54Z,2020-06-30 02:52:54,https://pbs.twimg.com/media/EbulzgEXgAEQ2Bh.jpg,1277797228577505280,1277797223489830913,0,4871511149,MetTaskforce,https://twitter.com/MetTaskforce/status/1277797228577505280,U4.2 starting off their night duties with an arrest for this sinister looking blade and possession with intent to supply Cannabis. Male spotted driving erratically and on being stopped he was searched and found in possession of this knife! https://t.co/pExvheMmrN,2020-06-30 02:52:54 MetTaskforce 1277797228577505280 0.jpg
06/28/2020 20:17:38,2020-06-28 20:17:38Z,2020-06-28 08:17:38,https://pbs.twimg.com/media/EboBuEDX0AA9i27.jpg,1277335371500736518,1277335335186452480,0,4871511149,MetTaskforce,https://twitter.com/MetTaskforce/status/1277335371500736518,U4:3 have been making inroads into the armouries of nefarious elements in @MPSLewisham this weekend. Arrests for possession of offensive weapons &amp; drugs supply have ended our working week on a high. #LivingForTheWeekend #StopAndSearch ^4823U https://t.co/WbuOGX3fIB,2020-06-28 08:17:38 MetTaskforce 1277335371500736518 0.jpg
06/28/2020 20:17:38,2020-06-28 20:17:38Z,2020-06-28 08:17:38,https://pbs.twimg.com/media/EboBumZXgAAVY9U.jpg,1277335371500736518,1277335344405512192,1,4871511149,MetTaskforce,https://twitter.com/MetTaskforce/status/1277335371500736518,U4:3 have been making inroads into the armouries of nefarious elements in @MPSLewisham this weekend. Arrests for possession of offensive weapons &amp; drugs supply have ended our working week on a high. #LivingForTheWeekend #StopAndSearch ^4823U https://t.co/WbuOGX3fIB,2020-06-28 08:17:38 MetTaskforce 1277335371500736518 1.jpg
06/28/2020 20:17:38,2020-06-28 20:17:38Z,2020-06-28 08:17:38,https://pbs.twimg.com/media/EboBvRkWkAA0kI0.jpg,1277335371500736518,1277335355994312704,2,4871511149,MetTaskforce,https://twitter.com/MetTaskforce/status/1277335371500736518,U4:3 have been making inroads into the armouries of nefarious elements in @MPSLewisham this weekend. Arrests for possession of offensive weapons &amp; drugs supply have ended our working week on a high. #LivingForTheWeekend #StopAndSearch ^4823U https://t.co/WbuOGX3fIB,2020-06-28 08:17:38 MetTaskforce 1277335371500736518 2.jpg
06/28/2020 20:17:38,2020-06-28 20:17:38Z,2020-06-28 08:17:38,https://pbs.twimg.com/media/EboBvssWsAQ_GUE.jpg,1277335371500736518,1277335363275632644,3,4871511149,MetTaskforce,https://twitter.com/MetTaskforce/status/1277335371500736518,U4:3 have been making inroads into the armouries of nefarious elements in @MPSLewisham this weekend. Arrests for possession of offensive weapons &amp; drugs supply have ended our working week on a high. #LivingForTheWeekend #StopAndSearch ^4823U https://t.co/WbuOGX3fIB,2020-06-28 08:17:38 MetTaskforce 1277335371500736518 3.jpg
06/27/2020 20:52:00,2020-06-27 20:52:00Z,2020-06-27 08:52:00,https://pbs.twimg.com/media/EbjABNxX0AASel3.jpg,1276981632424124416,1276981621468680192,0,4871511149,MetTaskforce,https://twitter.com/MetTaskforce/status/1276981632424124416,"U33 and @MPSFirearms attend call to male waving around a sword near to Shandy Park, Hartford Street, E1. Result: 1 young male arrested by U33 after finding him in possession of this horrific weapon!! #NoExcuses  ^3181U https://t.co/7qRx4tbDBJ",2020-06-27 08:52:00 MetTaskforce 1276981632424124416 0.jpg
06/25/2020 18:32:46,2020-06-25 18:32:46Z,2020-06-25 06:32:46,https://pbs.twimg.com/media/EbYMqCnWoAgfagl.jpg,1276221816005066753,1276221460802084872,0,4871511149,MetTaskforce,https://twitter.com/MetTaskforce/status/1276221816005066753,"Its sweaty work but someones got to do it. U4:3 have been across London over the last few days dealing with multiple call outs as well as making arrests for disqualified driving, public order offences and possession of offensive weapons. #SweatyBetty #SummerInTheCity ^4823U https://t.co/w1LdThngwa",2020-06-25 06:32:46 MetTaskforce 1276221816005066753 0.jpg
06/23/2020 21:33:38,2020-06-23 21:33:38Z,2020-06-23 09:33:38,https://pbs.twimg.com/media/EbOjLvJWkAA8jBu.jpg,1275542557263564801,1275542541505564672,0,4871511149,MetTaskforce,https://twitter.com/MetTaskforce/status/1275542557263564801,"U4:3 have been back at it since Monday on Commissioners Reserve shifts. Arrests for drug drive, drugs possession, possession of points and blades and GBH have got us off to a flying start across @MPSLewisham @MPSGreenwich @MPSBexley. #FunInTheSun #StopAndSearch 4823U https://t.co/AXFgFBbo68",2020-06-23 09:33:38 MetTaskforce 1275542557263564801 0.jpg
06/23/2020 21:33:38,2020-06-23 21:33:38Z,2020-06-23 09:33:38,https://pbs.twimg.com/media/EbOjMSyXQAMNzbp.jpg,1275542557263564801,1275542551072817155,1,4871511149,MetTaskforce,https://twitter.com/MetTaskforce/status/1275542557263564801,"U4:3 have been back at it since Monday on Commissioners Reserve shifts. Arrests for drug drive, drugs possession, possession of points and blades and GBH have got us off to a flying start across @MPSLewisham @MPSGreenwich @MPSBexley. #FunInTheSun #StopAndSearch 4823U https://t.co/AXFgFBbo68",2020-06-23 09:33:38 MetTaskforce 1275542557263564801 1.jpg
06/20/2020 22:10:26,2020-06-20 22:10:26Z,2020-06-20 10:10:26,https://pbs.twimg.com/media/Ea_O2J_X0AAk91g.jpg,1274464654018916352,1274464649359118336,0,4871511149,MetTaskforce,https://twitter.com/MetTaskforce/status/1274464654018916352,#TSG U544 arrested 3 males for possession with intent to supply Class B drugs and points and blades after a vehicle decamp on @MPSWestminster further arrests were made for dangerous driving and beach of criminal behaviour order #stopandsearch https://t.co/EndHE6LJvf,2020-06-20 10:10:26 MetTaskforce 1274464654018916352 0.jpg
06/20/2020 22:10:26,2020-06-20 22:10:26Z,2020-06-20 10:10:26,https://pbs.twimg.com/media/Ea_O2J7XQAA7f37.jpg,1274464654018916352,1274464649342304256,1,4871511149,MetTaskforce,https://twitter.com/MetTaskforce/status/1274464654018916352,#TSG U544 arrested 3 males for possession with intent to supply Class B drugs and points and blades after a vehicle decamp on @MPSWestminster further arrests were made for dangerous driving and beach of criminal behaviour order #stopandsearch https://t.co/EndHE6LJvf,2020-06-20 10:10:26 MetTaskforce 1274464654018916352 1.jpg
06/15/2020 19:51:26,2020-06-15 19:51:26Z,2020-06-15 07:51:26,https://pbs.twimg.com/media/Eak_FT1XgAI-KlS.jpg,1272617734182965248,1272617730164883458,0,4871511149,MetTaskforce,https://twitter.com/MetTaskforce/status/1272617734182965248,#TSG Great start to a week of Commissioners Reserves for U545. One male arrested on @MPSKenChel   after being detained for a stop and search. The below knife was found. #stopandsearch https://t.co/Hs0bhT7HkE,2020-06-15 07:51:26 MetTaskforce 1272617734182965248 0.jpg
06/10/2020 18:13:58,2020-06-10 18:13:58Z,2020-06-10 06:13:58,https://pbs.twimg.com/media/EaK401AXYAkzkcK.jpg,1270781267601129478,1270781262593220617,0,4871511149,MetTaskforce,https://twitter.com/MetTaskforce/status/1270781267601129478,Wandering mobile chef or knife-armed baddie? You decide 🤔 One #arrested in Chadwell Heath #RM6 after a #stopandsearch by #TSG #U31 @MPSRedbridge ^3021 https://t.co/KgObZJN4fa,2020-06-10 06:13:58 MetTaskforce 1270781267601129478 0.jpg
